sentence_id,review,aesthetics,cost,effectiveness,efficiency,enjoyability,general,learnability,reliability,safety,security
0000f3b3-0673-4b64-ae34-6c107e4e7b59,Chỉ có một vài điều tôi hy vọng họ sẽ thay đổi/sửa.,0.0,0.0,0.0,0.0,0.0,1.0,0.0,0.0,0.0,0.0
0012932e-16b4-43ec-ad34-69349e4cf72f,Có một số lỗi nghiêm trọng nhưng có thể chịu đựng.,0.0,0.0,0.0,1.0,0.0,0.0,0.0,0.0,0.0,0.0
0020b2f9-c8c2-4da8-8184-591428da9e0b,"Bạn đang kiếm đủ tiền, bạn bè ơi.",0.0,2.0,0.0,0.0,0.0,0.0,0.0,0.0,0.0,0.0
0025d723-0e1c-4396-844c-eefa019c156c,Tôi yêu thích việc tôi vẫn có thể tùy chỉnh nhưng tôi cảm thấy rằng có ít lựa chọn để tùy chỉnh hơn.,2.0,0.0,0.0,0.0,0.0,0.0,0.0,0.0,0.0,0.0
002884af-0be0-447f-a158-dcd828b5b0bd,Luôn khá phiền phức khi có các giao dịch mua hàng trong ứng dụng nhưng một số bộ bài thật sự thú vị đến nỗi tôi không ngại trả khoảng hai đô la cho chúng.,0.0,1.0,0.0,0.0,0.0,0.0,0.0,0.0,0.0,0.0
00343f76-af93-48f2-b2ce-c73a5b8bec0d,"Nếu bạn đang đọc đánh giá của tôi vì bạn đã thấy quảng cáo về trò chơi và muốn thử nó, đừng mua ứng dụng.",0.0,0.0,0.0,0.0,0.0,1.0,0.0,0.0,0.0,0.0
0062f558-16b0-4a87-941a-ed599a4f173f,Trong khi bạn là kẻ mạo danh.,0.0,0.0,0.0,0.0,0.0,1.0,0.0,0.0,0.0,0.0
0069ed2d-3e3b-4b1f-bc7b-747622feaeb5,"Nếu không, bạn phải chờ đến khi họ ""kết thúc lượt"" & điều này tạo ra vấn đề trong trò chơi.",0.0,0.0,0.0,0.0,0.0,1.0,0.0,0.0,0.0,0.0
007b3054-1e97-4a32-a6f6-5cff2f2a4897,"Tôi hoàn toàn ủng hộ việc chơi vui, nhưng nó không cân đối.",0.0,0.0,0.0,0.0,1.0,0.0,0.0,0.0,0.0,0.0
00954bae-74ac-4f61-a0e3-4bd3360a12f2,Tôi YÊU trò chơi này nhưng tôi THẬT SỰ rất bực mình.,0.0,0.0,2.0,0.0,0.0,0.0,0.0,0.0,0.0,0.0
00b1b29d-f16f-4187-9d64-623d35a594fd,"Tôi đã chơi Minecraft cả đời mình có vẻ như vậy, nhưng có điều gì đó không ổn với các skin tùy chỉnh.",0.0,0.0,0.0,0.0,0.0,1.0,0.0,0.0,0.0,0.0
00cb8f2c-1116-4fc8-b772-1192216cf7ec,(Tôi hy vọng điều đó có ý nghĩa) Dù sao thì đó cũng chỉ là điều duy nhất tôi muốn thay đổi!,0.0,0.0,0.0,0.0,0.0,2.0,0.0,0.0,0.0,0.0
00e14259-59c9-4cee-b3c3-9fc731970d95,Tôi không mong đợi vấn đề về lỗi từ một ứng dụng trả phí.,0.0,0.0,0.0,1.0,0.0,0.0,0.0,0.0,0.0,0.0
00f5a5a7-362b-453b-849f-491e73c6cc07,Từ các trận đấu đa người chơi cho đến các loại chế độ chơi game battle royale khác nhau.,0.0,0.0,0.0,0.0,0.0,2.0,0.0,0.0,0.0,0.0
00fe12b6-c7c4-4b3d-8fda-70b83f6243a5,Vui lòng VUI LÒNG VUI LÒNG SỬA ĐIỀU NÀY.,0.0,0.0,0.0,1.0,0.0,0.0,0.0,0.0,0.0,0.0
0120c8e5-2e79-47ed-9efb-e13091895d6e,"Vấn đề với trò chơi này là bạn làm đi làm lại cùng một việc, dù là ở cài đặt khác nhau hay không.",0.0,0.0,0.0,0.0,0.0,1.0,0.0,0.0,0.0,0.0
016439e4-e1e7-4928-b3dd-121b6f346307,Tôi sẽ thích nếu các bạn trở lại với phiên bản gốc của subway surfers.,0.0,0.0,0.0,0.0,0.0,2.0,0.0,0.0,0.0,0.0
0189e238-3649-4c0c-831c-3bc1da9ade42,"Nhưng gần đây nó đã trở nên giật lag, lỗi và thậm chí còn bị đứng hẳn khi tôi cố gắng chơi.",0.0,0.0,0.0,0.0,1.0,0.0,0.0,0.0,0.0,0.0
01caa069-baf9-44a2-96a3-46f31be2aba4,"Thực hiện một cuộc gọi, di chuyển một vật, đôi khi có thể kiếm được 2 sao!!",0.0,0.0,0.0,0.0,0.0,2.0,0.0,0.0,0.0,0.0
01f26599-f293-4666-b2d0-d9133d906313,Các cấp độ dường như trở nên thực sự khó khăn sau khi bạn bắt đầu tu sửa phòng thứ ba.,0.0,0.0,0.0,0.0,1.0,0.0,0.0,0.0,0.0,0.0
020a7637-2303-452f-aa44-d96984debf97,"anh trai tôi cũng thực sự thích trò chơi này, nhưng anh ấy cho rằng nó hơi thách thức ở tuổi của anh ấy.",0.0,0.0,0.0,0.0,2.0,0.0,0.0,0.0,0.0,0.0
02121c8a-1e97-411c-b410-f4fa7ce7f5cf,"Rõ ràng là cách gieo xúc xắc, bạn có thể đoán trước kết quả!",0.0,0.0,0.0,0.0,0.0,2.0,0.0,0.0,0.0,0.0
0230585a-67d6-4478-a074-3f527a122ef3,"Tuy nhiên, tổng thể trò chơi cảm thấy lạnh lẽo và cô đơn.",0.0,0.0,0.0,0.0,0.0,1.0,0.0,0.0,0.0,0.0
02346b11-f787-47c5-99ce-cc20295b07da,"Đã khoảng một tháng kể từ khi bạn nói rằng các cập nhật và Airship (bản đồ mới) sẽ đến với Among Us, chúng ở đâu!?",0.0,0.0,0.0,0.0,0.0,1.0,0.0,0.0,0.0,0.0
02416344-7c0e-47dd-a86b-6f75b890c058,"ngoại trừ những điều này thì đây thực sự là một trò chơi tuyệt vời, tôi chắc chắn sẽ giới thiệu.",0.0,0.0,0.0,0.0,0.0,2.0,0.0,0.0,0.0,0.0
024ab48e-07e4-4a5e-bbb9-337856bcb32d,Tôi yêu trò chơi này!,0.0,0.0,0.0,0.0,0.0,2.0,0.0,0.0,0.0,0.0
025fbef8-37e9-447f-a24d-62472bb5d7e3,"Khi chúng tôi hỏi họ đã làm gì vào cuối tuần, Amoung us là một trò chơi phổ biến mà tất cả họ đều chơi.",0.0,0.0,2.0,0.0,0.0,0.0,0.0,0.0,0.0,0.0
02721d7e-2897-4536-9b79-59fbba77565f,Tôi đã tiêu khoảng 15 đô la cho các bộ bài khác nhau.,0.0,1.0,0.0,0.0,0.0,0.0,0.0,0.0,0.0,0.0
0272fce9-dda3-4649-8c93-c8549c33625c,"Tôi thích trò chơi này nhưng khi tôi tiến bộ, tôi đã gặp một vấn đề lớn với các quả bom băng.",0.0,0.0,0.0,1.0,0.0,0.0,0.0,0.0,0.0,0.0
0280003c-9c29-46a8-82bf-d40cbcec4e52,Nhưng chúng tôi không thể chơi cùng nhau vì nó không hỗ trợ những nền tảng này cùng một lúc.,0.0,0.0,0.0,1.0,0.0,0.0,0.0,0.0,0.0,0.0
0288698e-55ad-4312-b21d-ee28161ea94d,Nó không nên được kết nối với ID Apple của bạn sao?,0.0,0.0,0.0,0.0,0.0,2.0,0.0,0.0,0.0,0.0
02b0c8cd-5c77-4fe8-a31b-5a79d04014e8,Tôi cũng muốn thấy phần thưởng tiền xu được cân đối hơn.,0.0,0.0,0.0,0.0,2.0,0.0,0.0,0.0,0.0,0.0
02b0e5e6-df8c-4ab5-9d56-80fbb17e4717,Nếu bạn thậm chí có thể gọi nó như vậy.,0.0,0.0,0.0,0.0,0.0,0.0,0.0,1.0,0.0,0.0
0302adb9-2542-4e35-b86a-fdfd90bc7a5c,Tôi rất vui khi bạn đã thêm chúng trở lại với bản cập nhật nether.,0.0,0.0,0.0,2.0,0.0,0.0,0.0,0.0,0.0,0.0
0305348a-d823-4d52-9548-82d68affe502,"Ngoài ra, mọi thứ đều như mong đợi, chỉ ước gì tôi có thể chơi với trí tuệ nhân tạo nhưng giờ đây thì không thể!",0.0,0.0,0.0,0.0,0.0,0.0,0.0,0.0,1.0,0.0
031237a7-6632-4c37-86b4-26c3fd29e210,"Tôi muốn thêm một con nữa, và quyết định lai giống chúng một lần nữa.",0.0,0.0,0.0,0.0,0.0,2.0,0.0,0.0,0.0,0.0
0356f5e3-1d63-4604-aea4-c7398207f3be,Một ứng dụng tuyệt vời để có trên các thiết bị điện tử của bạn.,0.0,0.0,2.0,0.0,0.0,0.0,0.0,0.0,0.0,0.0
035ba3d9-d8df-4edb-a321-2353a8296752,"Họ không cần phải hoàn hảo, vì bạn vẫn có thể chơi trò chơi mà không gặp vấn đề.",0.0,0.0,0.0,0.0,2.0,0.0,0.0,0.0,0.0,0.0
0360c81f-7921-445b-a4b1-3e8ac59150ae,Rất thất vọng nhưng mình đoán mình chỉ mất một đô la thôi 🤷🏻‍♀️🤷🏻‍♀️👎🏻👎🏻👎🏻,0.0,1.0,0.0,0.0,0.0,0.0,0.0,0.0,0.0,0.0
037fb15a-6970-483f-8d24-2c065c5a5ab2,"Trừ khi bạn sẵn lòng bỏ tiền, bạn sẽ không có những thế giới/skins vui nhộn và tương tác hơn.",0.0,1.0,0.0,0.0,0.0,0.0,0.0,0.0,0.0,0.0
038bf4d7-05af-49c0-ba0a-991f1de989e3,Tôi thích trò chơi này và sẽ tiếp tục chơi.,0.0,0.0,0.0,0.0,2.0,0.0,0.0,0.0,0.0,0.0
03971926-950b-44dd-8c97-e4db04f61beb,"Đối với phần đầu, nó sẽ là một màn hình giống như TV, thay đổi biểu cảm khuôn mặt.",0.0,0.0,2.0,0.0,0.0,0.0,0.0,0.0,0.0,0.0
03b2ccb6-a0b7-41dd-ae49-7d6698f68397,"Là một fan hâm mộ lớn của thiết kế nội thất, trò chơi này dường như hoàn hảo dành cho tôi.",2.0,0.0,0.0,0.0,0.0,0.0,0.0,0.0,0.0,0.0
03b41e87-d067-4427-bb23-dcf35f764b0f,Và có thể bạn có thể thêm một số loại súng vào trò chơi.,0.0,0.0,0.0,0.0,0.0,2.0,0.0,0.0,0.0,0.0
040008a1-831b-4e58-a039-c18acb40a295,Bạn có thể tạo ra chức năng để bạn có thể thêm người khác làm bạn bè không?,0.0,0.0,0.0,0.0,0.0,2.0,0.0,0.0,0.0,0.0
040abcf4-f8c0-4455-ab3e-d9019b997828,"Xin vui lòng và cảm ơn, hãy kiếm đến 5 sao chúng ta nhé!",0.0,2.0,0.0,0.0,0.0,0.0,0.0,0.0,0.0,0.0
04129e75-539f-40a6-8051-235813054551,"Không cần tạo tài khoản, không cần gì cả!",0.0,0.0,0.0,0.0,0.0,1.0,0.0,0.0,0.0,0.0
04189d4c-6d49-4d8c-b2c2-0cef4dad0445,"Tuy nhiên, tôi đã không thể mở ứng dụng này kể từ khi cập nhật.",0.0,0.0,1.0,0.0,0.0,0.0,0.0,0.0,0.0,0.0
04203ca1-8eba-4411-8cea-8cdce9bd7bd2,"Bạn bè tôi rất thích chơi trên ứng dụng, nhưng chỉ hoàn thành thành công một số ít trò chơi kể từ khi ứng dụng được phát hành.",0.0,0.0,0.0,0.0,2.0,0.0,0.0,0.0,0.0,0.0
0429432d-e090-44bc-a23d-b9cbf267b7c5,"Cập nhật lần 2: tôi đã lấy lại được những món đồ mà tôi mua, nhưng bây giờ lại có một vấn đề khác xuất hiện.",0.0,2.0,0.0,0.0,0.0,0.0,0.0,0.0,0.0,0.0
043e52a0-f236-4019-9cf5-784fbff70da9,"Và cảm nhận được cách chơi trò chơi, nhưng gần đây tôi đã chơi chế độ nhiều người chơi.",0.0,0.0,2.0,0.0,0.0,0.0,0.0,0.0,0.0,0.0
0454a845-f4f0-4b8f-91be-74269e30a530,"Đầu tiên, tôi đề xuất rằng trò chơi nên có nhiều loại động vật hơn (như voi, sư tử, hổ, cá mập, v.v).",0.0,0.0,0.0,0.0,1.0,0.0,0.0,0.0,0.0,0.0
0458d7b3-3a4a-4277-8de3-39a70f7b2c15,"Trò chơi này thật vui, nhẹ nhàng, thách thức và hoàn hảo trong một hoặc hai ngày đầu tôi bắt đầu chơi.",0.0,0.0,0.0,0.0,2.0,0.0,0.0,0.0,0.0,0.0
048b48c3-0fdc-4ad6-8805-e89af10a37ea,Ứng dụng này áp dụng cách tiếp cận đơn giản hơn bằng cách tạo ngẫu nhiên thẻ sau mỗi lần rút.,0.0,0.0,0.0,0.0,0.0,2.0,0.0,0.0,0.0,0.0
04945b56-3137-42dd-9a81-a4822cb81844,Tôi mua một trong những đường sắt của họ với một giá cắt cổ.,0.0,1.0,0.0,0.0,0.0,0.0,0.0,0.0,0.0,0.0
04a7f4d4-e579-4f5d-8d07-e1807d4f83d8,Một trò chơi đã dạy chúng ta không bao giờ đặt giới hạn cho trí tưởng tượng của mình.,0.0,0.0,0.0,0.0,2.0,0.0,0.0,0.0,0.0,0.0
04accc55-af91-47ae-8e7f-e84dd5df1b11,Tôi muốn có thể sử dụng 100 đồng xu cho mỗi lượt di chuyển mà tôi muốn thêm.,0.0,2.0,0.0,0.0,0.0,0.0,0.0,0.0,0.0,0.0
04ba3d8f-b398-4f0e-94e8-dd078ae2dd56,Đã xảy ra chuyện gì với việc sáng tạo?,0.0,0.0,1.0,0.0,0.0,0.0,0.0,0.0,0.0,0.0
04bb1688-a21b-4cc0-beae-8aa69ac8b31c,Hãy để tôi giải thích về điều cuối cùng hoặc tại sao tôi không thể nói rằng tôi yêu trò chơi này nữa.,0.0,0.0,0.0,0.0,0.0,2.0,0.0,0.0,0.0,0.0
04f09b07-cd79-48b6-96eb-04253863ae45,"Tôi đã trả tiền cho ứng dụng này và giờ đây với các biện pháp cách ly được áp dụng, tôi không có cơ hội gặp gỡ bạn bè của mình ngoại trừ việc giữ khoảng cách!",0.0,0.0,0.0,0.0,0.0,1.0,0.0,0.0,0.0,0.0
04f3d79e-6737-433f-8266-6e84603104a8,Không có gì xảy ra khi tôi không đăng nhập.,0.0,0.0,0.0,0.0,0.0,2.0,0.0,0.0,0.0,0.0
04fa3f8c-8c9d-4128-aee7-fc061d5a517b,"Trên hết tất cả, cách chơi của trò chơi này thật sự không công bằng.",0.0,0.0,0.0,0.0,0.0,1.0,0.0,0.0,0.0,0.0
050fcae4-8b8b-4e8d-b6a0-6d2913006d85,"Đừng hiểu lầm, mọi người đều như vậy!",0.0,0.0,0.0,0.0,0.0,0.0,0.0,0.0,1.0,0.0
05146d40-5aad-4c33-9814-f7246bbdff14,"Ồ, và tôi hoàn toàn từ chối bỏ ra bất kỳ số tiền nào cho trò chơi này.",0.0,2.0,0.0,0.0,0.0,0.0,0.0,0.0,0.0,0.0
0527783d-705f-4184-9ae7-5666012cab95,"Nếu bạn giết một wither, enderdragon, và forden, chúng sẽ rơi ra một thứ gọi là Bản đồ hỏng.",0.0,0.0,0.0,0.0,0.0,1.0,0.0,0.0,0.0,0.0
0559e3a0-6935-4949-97ff-a0587948a530,"Các nhà phát triển, bạn có thể giảm nó xuống một chút và để mọi người thực sự có thể vượt qua trò chơi như những trò chơi được dự định?",0.0,0.0,0.0,0.0,1.0,0.0,0.0,0.0,0.0,0.0
056d3899-9754-48b4-8668-a197352cc9d1,"Cài đặt và tất cả những thứ thông thường nên được giữ lại nhưng hãy thực hiện những cải tiến đó plz!,!,!,!",0.0,0.0,0.0,0.0,0.0,2.0,0.0,0.0,0.0,0.0
05ad3cf1-3d14-48d1-bb6d-188555d9820e,"Tuy nhiên, tôi đã nhận thấy trong bản cập nhật gần đây, RẤT NHIỀU lỗi mới và vấn đề đã xảy ra.",0.0,0.0,0.0,0.0,0.0,0.0,0.0,1.0,0.0,0.0
05e086c5-6011-4d0a-a258-9cc879dc3ed7,Giờ quay lại với niềm vui!!,0.0,0.0,0.0,0.0,2.0,0.0,0.0,0.0,0.0,0.0
05e32f93-c530-4744-91c0-65a6dc195cf7,"Nó quá khó để sử dụng và tôi không thể trả lời đủ nhanh, nó quá rối rắm.",0.0,0.0,1.0,0.0,0.0,0.0,0.0,0.0,0.0,0.0
05eafdec-12d6-40fe-84dd-74698efdb2ef,"Tôi cũng đã có điểm SỐ RẤT CAO, tôi đang ở mức đầu tiên của huy chương vàng và tất cả mọi thứ!",0.0,0.0,0.0,2.0,0.0,0.0,0.0,0.0,0.0,0.0
062492a8-7b14-4698-9460-25795d2f3ab8,3: Tôi không thích việc bạn chỉ nhận được 1 sao cho mỗi trò chơi.,0.0,0.0,0.0,0.0,1.0,0.0,0.0,0.0,0.0,0.0
0635e52f-f171-41f6-8f56-f5239f88dbe2,Nhiều trò chơi mà tôi đã mua trước đây giờ đã được gói gọn và tôi phải mua chúng một lần nữa!,0.0,0.0,0.0,0.0,0.0,0.0,0.0,0.0,2.0,0.0
067c6a65-49d1-4fe4-9700-a6e9c066eddf,"Tôi sẽ đợi đến khoảng tháng 11, vì họ đã nói đó là lúc nó nên được sửa chữa.",0.0,0.0,0.0,0.0,0.0,2.0,0.0,0.0,0.0,0.0
06812711-6ac4-4622-b557-b5ec7512f91a,Chắc chắn sẽ giới thiệu.,0.0,0.0,0.0,0.0,0.0,2.0,0.0,0.0,0.0,0.0
06a5c0b4-0eb6-4645-a2f1-1d649554d26c,"Và tôi quên, đôi khi người chơi tạo ra máy chủ và mọi người tham gia, chỉ để bị đá ra hoặc chặn bởi chủ máy chủ.",0.0,0.0,0.0,0.0,0.0,0.0,0.0,0.0,1.0,0.0
06aa496f-fccd-48cb-a95a-465f35380618,Nó rất vui và có thể chơi ở bất cứ đâu trong nhiều giờ.,0.0,0.0,0.0,0.0,2.0,0.0,0.0,0.0,0.0,0.0
06c47cef-925b-46de-ba6e-85631a652761,Trò chơi này thực sự tuyệt vời ở rất nhiều khía cạnh.,0.0,0.0,2.0,0.0,0.0,0.0,0.0,0.0,0.0,0.0
06e584f9-4513-4bb0-a244-75db3c0af50b,Tôi biết rằng nó rất thực tế nhưng ứng dụng nên được cải tiến hơn một chút và sửa những điều tẻ nhạt như vậy.,0.0,0.0,0.0,1.0,0.0,0.0,0.0,0.0,0.0,0.0
06ed495d-1a4c-4059-9468-b381a7854c87,"Nhưng, khi tôi tiến về phía lỗi nhưng lại đi sang trái hoặc phải, và tiếp tục đi... đi... đi.",0.0,0.0,0.0,0.0,0.0,1.0,0.0,0.0,0.0,0.0
0701c48b-0312-4529-b6b9-ce7f5d7953e0,Có một lỗi nơi nó bảo rằng đang đăng nhập vào tài khoản của bạn mặc dù 20 phút sau nó vẫn đang cố gắng đăng nhập.,0.0,0.0,0.0,0.0,0.0,0.0,0.0,1.0,0.0,0.0
07097989-b622-4f95-bd04-32ecff1de6b4,Đôi khi tôi nhận được một quảng cáo dài 30 giây mà không thể bỏ qua.,1.0,0.0,0.0,0.0,0.0,0.0,0.0,0.0,0.0,0.0
0717206d-5915-4d7d-b3db-bd73bf7b9963,"Tôi thích trò chơi này, nhưng nó có một vài vấn đề.",0.0,0.0,0.0,0.0,0.0,1.0,0.0,0.0,0.0,0.0
07226dfc-7f99-4d04-b948-0f86c4a02c90,Cũng thật tuyệt nếu thêm vào tính năng kết bạn!,0.0,0.0,0.0,0.0,0.0,2.0,0.0,0.0,0.0,0.0
0747df35-a4da-4a38-95e8-29df81e7769b,"Nếu có một vai trò được gọi là ""Jester"" với mục tiêu là bị đuổi, khiến họ chiến thắng thì sao?",0.0,0.0,0.0,0.0,2.0,2.0,0.0,0.0,0.0,0.0
0748d042-2361-4408-8600-3f56ff562e41,Tôi đã tải xuống Homescapes vì đã thấy quảng cáo về trò chơi này trên Words With Friends.,0.0,0.0,0.0,0.0,0.0,2.0,0.0,0.0,0.0,0.0
078d1612-5acc-4198-b53e-2b1134009d80,Tôi cảm thấy bực bội vì việc cần QUÁ NHIỀU sao để dọn dẹp một phòng.,0.0,0.0,0.0,0.0,0.0,1.0,0.0,0.0,0.0,0.0
07935217-1ce9-4192-afcc-cf7e3a92b2ac,Điểm duy nhất không tốt về trò chơi này là những chiếc hover board và các nhân vật đều tốn RẤT NHIỀU đồng xu và chìa khóa.,0.0,2.0,0.0,0.0,0.0,0.0,0.0,0.0,0.0,0.0
07a45ec6-0118-457f-bd99-b397dfc35ca8,"Ngoài ra, một cách để giảm bớt vấn đề này là cung cấp cho người chơi lựa chọn không sử dụng chức năng chat mới để họ có thể tự gõ những gì họ muốn.",0.0,0.0,0.0,0.0,0.0,1.0,0.0,0.0,0.0,0.0
07cf3037-f374-4b7a-bb91-b9334db0ed81,"Và có thể, bạn có thể thêm nhiều boss hơn sau này.",0.0,0.0,0.0,0.0,0.0,0.0,0.0,2.0,0.0,0.0
07fda964-cb36-4b00-b6e5-1152ff4fb94d,Tôi khá tức giận vì mất rất nhiều thời gian để tiết kiệm cho tất cả các nhân vật mà tôi đã có.,0.0,0.0,0.0,0.0,0.0,2.0,0.0,0.0,0.0,0.0
08490e1c-a761-4577-b495-5135689efed2,"Tôi nhớ đã nghĩ rằng các nền tảng Minecraft rất nhỏ, nhưng thực ra, tôi chỉ đang ở trên một hòn đảo.",0.0,0.0,2.0,0.0,0.0,0.0,0.0,0.0,0.0,0.0
08507dfc-2628-485e-8fc4-de2996e54cdf,"Với 2 người chơi phá sản, tôi có ít nhất một nghìn đô la, từ 2-4 cục đất độc quyền tất cả đều có một vài ngôi nhà và khách sạn.",0.0,0.0,0.0,0.0,0.0,0.0,0.0,0.0,0.0,1.0
08593ed6-7ba8-4325-9924-add80aa32638,"Không nói dối, vào những lúc như vậy thật sự rất làm mình bực bội bởi chỉ có 5 mạng và tốc độ phục hồi rất chậm.",0.0,0.0,0.0,0.0,0.0,0.0,1.0,0.0,0.0,0.0
085aa922-bfde-4343-aa2c-23c3e397c923,"Khi tôi phải xóa và cài đặt lại ứng dụng đi đi lại lại, thì thật sự bắt đầu làm tôi cảm thấy khó chịu.",0.0,0.0,1.0,0.0,0.0,0.0,0.0,0.0,0.0,0.0
08688114-0f78-4f91-bbdd-4dacb98bcb58,"Có, bạn có thể đuổi người khác ra khỏi máy chủ nhưng bạn cũng phải thuyết phục được ba người khác cùng làm điều đó hoặc bạn là người đã tạo ra máy chủ.",0.0,0.0,0.0,0.0,0.0,2.0,0.0,0.0,0.0,0.0
087c5fed-190c-4cb5-86ea-0141f4ffc06e,"Các máy chủ rất vui khi chơi, và thường có nhiều loại game trên các máy chủ.",0.0,0.0,0.0,0.0,2.0,0.0,0.0,0.0,0.0,0.0
08bd3e8b-11c1-4343-ab76-33f17ab2f91d,Điều đó sẽ được đánh giá cao.,0.0,0.0,0.0,0.0,0.0,2.0,0.0,0.0,0.0,0.0
08efeecb-0c6e-406c-8821-46965a66a8a7,Tôi có thể phải xóa nó để bảo vệ chiếc heo đất của mình.,0.0,0.0,0.0,0.0,0.0,1.0,0.0,0.0,0.0,0.0
0940cfcb-fc43-46fd-bc09-eb091a5159a2,Để tiếp tục một trò chơi (với 900 đồng tiền) chỉ cho một hoặc hai lượt di chuyển thì thật sự tốn kém khi xét đến việc bạn thực sự không thắng được nhiều.,0.0,0.0,0.0,0.0,1.0,0.0,0.0,0.0,0.0,0.0
094355aa-144f-4b7e-8f65-308f8e59918f,Điều đó không có liên kết gì với người chơi và thậm chí không thể nhận được bằng cách sử dụng các lực lượng tăng cường.,0.0,0.0,1.0,0.0,0.0,0.0,0.0,0.0,0.0,0.0
09450dee-1177-4f92-94a3-21c4c3f8e70b,Đánh giá 2 sao của tôi là vì cộng đồng.,0.0,0.0,0.0,0.0,1.0,0.0,0.0,0.0,0.0,0.0
096bb38c-008a-427e-b79f-799e43f7311c,Chúc mừng heads up đã bán được 1 tỷ bộ bài và tôi hy vọng bạn sẽ bán được thêm 1 tỷ nữa.,0.0,2.0,0.0,0.0,0.0,0.0,0.0,0.0,0.0,0.0
098b8529-705d-444b-850f-39929a6ac85f,Tôi phải đánh giá trò chơi này mức điểm khá thấp chỉ dựa trên nguyên tắc về cách tiếp thị không trung thực của nó.,0.0,0.0,0.0,0.0,0.0,1.0,0.0,0.0,0.0,0.0
09967716-923d-4cc0-81ea-55275249960c,Tôi vẫn nghĩ rằng trò chơi này hoàn toàn đáng yêu và được suy nghĩ kỹ lưỡng.,0.0,0.0,0.0,0.0,0.0,2.0,0.0,0.0,0.0,0.0
09986254-1b1d-4665-bbcb-62875b8c0871,Tôi đã thấy một đánh giá nói rằng nó trông như được một đứa trẻ vẽ ra.,0.0,0.0,0.0,0.0,0.0,2.0,0.0,0.0,0.0,0.0
099bf946-3ccd-48c4-a681-bb4a9f24b187,"Thứ hai, những hình ảnh động thật sự rất khó chịu!",1.0,0.0,0.0,0.0,0.0,0.0,0.0,0.0,0.0,0.0
09a31993-8597-4a66-9234-a0b47e339442,Tôi mệt mỏi khi thấy bộ bài pretty little liars ví dụ mà tôi biết rằng tôi sẽ không bao giờ mua.,0.0,0.0,1.0,0.0,0.0,0.0,0.0,0.0,0.0,0.0
0a01acd9-ef4e-4b9f-8574-57aab1c54b0f,Nhưng một vấn đề lớn đối với tôi là việc chơi trò chơi thực sự.,0.0,0.0,0.0,0.0,0.0,1.0,0.0,0.0,0.0,0.0
0a177bfa-bb68-45cb-bcb6-e03870b128cd,Tôi thích among us rất nhiều!,0.0,0.0,0.0,0.0,0.0,2.0,0.0,0.0,0.0,0.0
0a3ed791-f278-4445-9b6d-1b425896ab6d,"Điều thứ ba là có khả năng trò chuyện (khi bạn còn sống) ngoài ""Cuộc họp khẩn cấp"".",0.0,0.0,0.0,0.0,0.0,1.0,0.0,0.0,0.0,0.0
0a41ae4d-2eeb-43f3-86a3-5991f8aedf07,"Nghiêm túc mà nói, trò chơi trước đây đã đủ tốt để mọi lứa tuổi có thể chơi, nhưng bây giờ dường như chỉ có trẻ em 6 tuổi có thể thích thiết kế này.",0.0,0.0,0.0,1.0,0.0,0.0,0.0,0.0,0.0,0.0
0a5c5f02-f4c1-4e57-b343-9b330540e550,Nó chắc chắn có thể giúp bạn giết thời gian.,0.0,0.0,0.0,0.0,2.0,2.0,0.0,0.0,0.0,0.0
0a643ee2-44e9-4bf8-b584-2a58adb0248d,Tôi đã mua cho anh ấy một ngày trước và đó là lãng phí thời gian và tiền bạc của tôi.,0.0,1.0,0.0,0.0,0.0,0.0,0.0,0.0,0.0,0.0
0a788893-a282-498c-8464-6afa8946dcbc,Tôi thấy chúng thật vui và thậm chí còn gây nghiện.,0.0,0.0,0.0,0.0,2.0,0.0,0.0,0.0,0.0,0.0
0a956309-3824-42f1-9de8-9aaa147b5fba,Họ làm hỏng trò chơi rất nhiều.,0.0,0.0,0.0,0.0,0.0,2.0,0.0,0.0,0.0,0.0
0a95f8ee-3e86-40b0-9cce-4d77116ef0d6,Tôi đã chơi MCPE một lần trong vài phút trên máy tính bảng của một người bạn gần 6 năm trước và từ đó tôi đã mê mẩn trò chơi này.,0.0,0.0,0.0,0.0,2.0,0.0,0.0,0.0,0.0,0.0
0b11d780-a212-486a-96a9-1ce0cbfcbab8,"Tôi vẫn muốn sáng tạo và có ""niềm vui""!",0.0,0.0,0.0,0.0,2.0,0.0,0.0,0.0,0.0,0.0
0b1ba139-3470-4667-bada-f0075851e48f,Vấn đề duy nhất tôi gặp với trò chơi là tùy chọn bạn bè.,0.0,0.0,0.0,0.0,1.0,0.0,0.0,0.0,0.0,0.0
0b1c3e81-b21a-4707-8f7b-7832736a8762,"Tôi nhận ra rằng họ muốn bạn tiêu tiền và tôi đã tiêu, nhưng ngay cả khi bạn tiêu, nó không đem lại cho bạn nhiều lợi ích.",0.0,1.0,0.0,0.0,0.0,0.0,0.0,0.0,0.0,0.0
0b26ddc1-7282-4780-a7a4-14f6fb68e4c4,"Nhưng, tôi muốn đề nghị một tính năng.",0.0,0.0,0.0,0.0,0.0,1.0,0.0,0.0,0.0,0.0
0b3c07a9-1452-48a4-8132-304407e1cb50,"Dù sao, tôi cũng thích cách trò chơi có thể tùy chỉnh và có bố cục tuyệt vời.",2.0,0.0,0.0,0.0,0.0,0.0,0.0,0.0,0.0,0.0
0b3fc6a5-cc02-4ddb-ae8a-94e2a1f5f721,Đã phải mua ứng dụng và giờ tôi cũng phải mua từng bổ sung thêm nữa.,0.0,0.0,0.0,0.0,1.0,0.0,0.0,0.0,0.0,0.0
0b621b76-8563-405f-8be2-0646eb7b0d67,"Và cửa hàng trong game có một số skin, thế giới miễn phí và thường có những giao dịch khá tốt.",0.0,0.0,0.0,0.0,0.0,2.0,0.0,0.0,0.0,0.0
0b7ea127-fda2-4827-8859-f838c8e1a336,Trò chơi này thật tuyệt vời!,0.0,0.0,0.0,0.0,2.0,0.0,0.0,0.0,0.0,0.0
0b98a135-0896-4d5d-8963-0e3e939b4d16,Như nếu bạn biết người đó trong đời thực hoặc nếu bạn thích chơi với họ!,0.0,0.0,0.0,0.0,0.0,1.0,0.0,0.0,0.0,0.0
0bb2dd4a-efd1-4227-bea0-6eafdd5eafa4,Nếu hệ thống phần thưởng hoạt động giống như trò chơi của Zynga thì chúng có thể tồn tại lâu hơn.,0.0,0.0,2.0,0.0,0.0,0.0,0.0,0.0,0.0,0.0
0c1e7d9c-dd57-4854-b8ec-921fab4432e3,Gói động vật và gói diễn xuất là những gói mà chúng tôi yêu thích nhất cho đến nay.,0.0,0.0,0.0,0.0,2.0,0.0,0.0,0.0,0.0,0.0
0c2c5958-fc95-4ede-aff0-48b2e1c9eaa9,Đã có vô số trò chơi mà cả tôi và anh em tôi đã chơi nơi người chơi AI sống sót lâu hơn chúng tôi vì nó nhận được lượt chơi thuận lợi.,0.0,0.0,0.0,0.0,2.0,0.0,0.0,0.0,0.0,0.0
0c4c9ecb-332e-4fe4-973a-0051530d3ed3,Trò chơi thực tế rất gọn gàng.,0.0,0.0,0.0,0.0,0.0,2.0,0.0,0.0,0.0,0.0
0c54fcd4-cf4e-4116-a667-3dcf9082496e,"Khi tải xuống, nó đã cho tôi thông báo 'tải xuống gia đình', và đó là lựa chọn duy nhất, tôi tất nhiên đã sử dụng nó.",0.0,0.0,2.0,0.0,0.0,0.0,0.0,0.0,0.0,0.0
0c5b53cd-4c4d-4770-823c-eb3de4b0a980,bạn đã thêm nhiều thứ vào trò chơi nhưng lại chưa khắc phục được các lỗi.,0.0,0.0,0.0,0.0,0.0,0.0,0.0,2.0,0.0,0.0
0c5d0c5f-8cc4-4e0d-b11b-b2b80ca7a2e3,Có thể bạn có thể cài đặt một thứ gì đó có thể phát hiện chương trình của họ và những thứ khác?,0.0,0.0,0.0,0.0,0.0,0.0,0.0,2.0,0.0,0.0
0c5ef691-0029-4214-86d8-668ebffdfffc,"Họ không cung cấp cho tôi bất cứ thứ gì để vượt qua chướng ngại vật khó chịu và tôi đã chết. Tôi đã lãng phí tất cả các bảng, chìa khóa và lợi thế ban đầu của mình cho không!",0.0,0.0,0.0,0.0,0.0,2.0,0.0,0.0,0.0,0.0
0c7bb59c-1463-4197-a604-96790c887abc,Tôi phải đi rồi nhưng tôi khuyên bạn nên tải ứng dụng này!!!,0.0,0.0,0.0,0.0,0.0,2.0,0.0,0.0,0.0,0.0
0c7cdfeb-efde-4789-afd1-3f3b3eab8b77,"Vì vậy, hãy gỡ bỏ tính năng này và quay trở lại trạng thái ban đầu.",1.0,0.0,0.0,0.0,0.0,0.0,0.0,0.0,0.0,0.0
0c852932-8d12-4388-a74d-126d139a9147,"Phần thưởng cho các cấp độ không hề gần với mức nó nên có, và số lượng bạn nhận được so với số tiền bạn trả cũng không đủ.",0.0,0.0,0.0,0.0,0.0,1.0,0.0,0.0,0.0,0.0
