sentence_id,review,aesthetics,cost,effectiveness,efficiency,enjoyability,general,learnability,reliability,safety,security
78577df0-9329-4c33-a630-211986283c2b,"Nếu bạn đã từng xem bất kỳ quảng cáo nào về trò chơi này thì có lẽ bạn đã thấy loại hình chơi ""rút chốt"" được trình bày để thu hút bạn vào.",0.0,0.0,0.0,0.0,0.0,0.0,0.0,1.0,0.0,0.0
7866d6c7-dc9e-4db1-b313-8cb65c100739,"Bạn BIẾT đây là trò chơi phổ biến nhất trên thị trường hiện nay, vì vậy xin đừng lờ đi những vấn đề này và hãy cố gắng khắc phục chúng.",1.0,0.0,0.0,0.0,0.0,0.0,0.0,0.0,0.0,0.0
78709884-bc40-4dc3-8e77-1a7709eb27ce,"những lựa chọn mà người chơi thực hiện thật vô lý và họ lặp đi lặp lại sau mỗi lượt chơi, ngay cả khi bạn làm cho họ im lặng trong lượt đó.",0.0,0.0,0.0,0.0,1.0,0.0,0.0,0.0,0.0,0.0
787a9f46-abe0-41bb-a3e0-c208b8cc33a2,Tôi nghĩ bạn nên có thể nhận được đồng tiền để mua những thứ mới và bạn có thể nhận đồng tiền bằng cách thắng các trò chơi.,0.0,1.0,0.0,0.0,0.0,0.0,0.0,0.0,0.0,0.0
7883a58e-69d7-4463-ae1f-0d8019c56417,"Lily coco aina Vì vậy, tôi đã yêu thích trò chơi này từ lâu, tôi đã có nó trong iPod của mình và chơi nó cùng gia đình.",0.0,0.0,0.0,0.0,1.0,0.0,0.0,0.0,0.0,0.0
7888626c-8fe4-4b02-9f60-88596f449634,"Và khi tôi tham gia vào một trong những minigame, cụ thể là minigame High-School Roleplay, thì có vấn đề với skin tùy chỉnh của tôi.",0.0,0.0,0.0,0.0,1.0,0.0,0.0,0.0,0.0,0.0
78931904-e56c-445c-8d47-18593bfc54cc,Minecraft là trò chơi hay nhất từ trước tới nay!,0.0,0.0,0.0,0.0,0.0,2.0,0.0,0.0,0.0,0.0
78b5da62-fd56-43b1-8dd9-e2539fb9cf8b,Tôi không thể tải nó về thiết bị của mình.,0.0,0.0,0.0,0.0,0.0,1.0,0.0,0.0,0.0,0.0
78c8c92d-9aa2-40c4-82ce-b76643f139b2,Tôi đã thấy rất nhiều gia đình giết thời gian bằng cách chơi trò chơi này và chỉ cần nhìn họ chơi đã thấy rất vui.,0.0,0.0,0.0,0.0,2.0,0.0,0.0,0.0,0.0,0.0
78cbb5d0-2223-4ca5-b190-6007f8c78e8b,Phải mua một chiếc điện thoại mới vì cái cũ của tôi bị hỏng.,0.0,0.0,0.0,0.0,0.0,1.0,0.0,0.0,0.0,0.0
78d0b0ac-fc1f-42ae-a850-2015883f4476,"Như những người bạn, những ngày tháng, năm đã lướt qua cuộc đời tôi, trò chơi này luôn luôn ở bên cạnh tôi.",0.0,0.0,0.0,0.0,0.0,2.0,0.0,0.0,0.0,0.0
79329be3-406d-4ad3-89da-93b68d6ae53a,Mặc dù nó không cao lắm nhưng tôi vẫn MUỐN có nó.,0.0,0.0,0.0,0.0,2.0,0.0,0.0,0.0,0.0,0.0
794df099-6a0b-4067-a68b-c21122a053ca,"Sau một thời gian, tôi thấy mình muốn chơi trò chơi này nhiều hơn nữa.",0.0,0.0,2.0,0.0,0.0,0.0,0.0,0.0,0.0,0.0
7962eeb4-8f5d-40ca-95e2-46a04a47d190,TÔI YÊU ứng dụng này và đội ngũ đã làm việc nhanh chóng để khắc phục các lỗi gần đây khi ứng dụng không mở được cho bản cập nhật kỷ niệm 5 năm.,0.0,0.0,0.0,0.0,0.0,2.0,0.0,0.0,0.0,0.0
7984e3fd-fd6e-47a2-9a31-4dc412130c1d,"Bạn thậm chí còn có thể đọc trang 'Facebook' giả của khu phố, đó thực sự là một ý tưởng đáng yêu và sáng tạo!",0.0,0.0,0.0,0.0,0.0,2.0,0.0,0.0,0.0,0.0
798d724d-a0b7-4005-ac81-1f01263a1c6e,Vấn đề lớn nhất của tôi là chạy đỉnh.,0.0,0.0,0.0,0.0,0.0,0.0,0.0,1.0,0.0,0.0
799ce788-c5ad-4de8-8f25-f80fdb4d599e,Thêm tính năng micro cũng sẽ rất tốt.,0.0,0.0,0.0,0.0,0.0,2.0,0.0,0.0,0.0,0.0
79a011d9-bc39-4690-972c-fb96b5565ec1,Tôi sẽ cập nhật sau.,0.0,0.0,0.0,0.0,0.0,2.0,0.0,0.0,0.0,0.0
79afda51-155c-40af-98d7-b38c71143754,"Người chơi thường sử dụng 2100 đồng xu để mua thêm 10 lượt di chuyển không? Nếu họ sử dụng, họ cần thêm 5 lượt nữa để thắng hay chỉ cần 1 lượt?",0.0,0.0,0.0,0.0,0.0,0.0,2.0,0.0,0.0,0.0
79ea24a0-1045-4b94-bbf0-2c8b8d665f09,Tôi và con tôi đều rất yêu thích ứng dụng này.,0.0,0.0,0.0,0.0,2.0,0.0,0.0,0.0,0.0,0.0
79ff5aba-0bd5-49dd-adcc-85a9571b0ec6,Tôi không thích bản cập nhật này và thực sự nghĩ rằng chúng ta nên đổi lại cách trò chuyện cũ.,0.0,0.0,1.0,0.0,0.0,0.0,0.0,0.0,0.0,0.0
7a1278ce-09b1-4623-a6e0-ef7b46bb3399,Dù đó là bạn hay một người chơi được tạo bởi máy tính khác.,0.0,0.0,0.0,0.0,0.0,2.0,0.0,0.0,0.0,0.0
7a1fe777-3f79-45b6-8c94-a5409cc93e17,Khả năng có tùy chọn người chơi ngẫu nhiên và tùy chọn bảng ngẫu nhiên sẽ rất tốt cho những người như chúng tôi đã mở khóa mọi thứ.,0.0,0.0,0.0,0.0,0.0,0.0,0.0,0.0,2.0,0.0
7a227a43-7ea4-4907-a15f-fdff2ded6f61,Điều đó thật buồn cười và không có trò chơi nào khác làm như vậy.,0.0,0.0,0.0,0.0,0.0,1.0,0.0,0.0,0.0,0.0
7a234527-dade-4cab-9886-fe741f46bb13,"Thành thật, TGterminator (tên tài khoản của tôi.)",0.0,0.0,0.0,0.0,0.0,2.0,0.0,0.0,0.0,0.0
7a319d0f-568a-4e91-ac84-5fb1ba4d876b,"Vì vậy, điều mà tôi đang cố gắng nói là tôi hoàn toàn yêu thích Minecraft và muốn giới thiệu nó cho mọi người!",0.0,0.0,2.0,0.0,0.0,0.0,0.0,0.0,0.0,0.0
7a75de97-4ed5-4e1c-b393-f467a4e77dc3,"Nhưng cũng có một lỗi, tôi tham gia một trò chơi với một người chơi (đó là những gì nó nói) nhưng hóa ra nó đã đầy!",0.0,0.0,0.0,1.0,0.0,0.0,0.0,0.0,0.0,0.0
7a75ff93-2dfd-4854-a307-dace98989196,Hãy thử nghiệm xem!,0.0,0.0,0.0,0.0,0.0,2.0,0.0,0.0,0.0,0.0
7a7c8c8c-3e30-4199-a8ec-931519af0b1f,vui lòng đọc các đánh giá và học hỏi từ những lỗi của bạn vì bản cập nhật này thực sự rất lớn.,0.0,0.0,0.0,0.0,0.0,0.0,0.0,0.0,0.0,2.0
7a8eb62f-fde9-4da4-95b7-ae92ca79b65e,Chỉ nhận được 60 đồng xu cho một câu đố mà tôi đã phải vượt qua 20 lần.,0.0,1.0,0.0,0.0,0.0,0.0,0.0,0.0,0.0,0.0
7abec0ce-4ee3-4439-bc6e-78540bd13877,"Kết luận, trò chơi này chỉ thú vị trong 60 cấp độ đầu tiên sau đó trở nên frustrate.",0.0,0.0,0.0,0.0,1.0,0.0,0.0,0.0,0.0,0.0
7ade81d9-c070-47b5-b09b-7b9598c540ad,Tôi hoàn toàn yêu thích trò chơi này.,0.0,0.0,0.0,0.0,2.0,0.0,0.0,0.0,0.0,0.0
7ae9ce9f-b0e1-4dca-b326-675bd8eada1a,Tôi đã gặp tổng cộng một kẻ lập dị và mọi thứ hoàn toàn ổn.,0.0,0.0,0.0,0.0,0.0,2.0,0.0,0.0,0.0,0.0
7aeaf6a7-9937-4b45-bd13-63c3c7acb814,"Xin lỗi vì tôi không thể đánh giá 5 sao, nhưng tôi sẽ làm nếu bạn khắc phục những vấn đề 🥺.",0.0,0.0,2.0,0.0,0.0,0.0,0.0,0.0,0.0,0.0
7b05b55a-6a5e-4211-a39e-c399fc531ee1,Bạn có nghĩ rằng bạn có thể làm điều đó khi bạn chết bạn có thể xem toàn bộ bản đồ không?,0.0,0.0,0.0,0.0,0.0,0.0,0.0,1.0,0.0,0.0
7b2075f3-a656-4cc8-a61a-a885e39a91ee,"Ví dụ: Tôi bắt đầu chơi thử miễn phí và thấy một tùy chọn nói ""bạn có muốn bật chế độ thông minh không?"" Tôi bật nó lên và chế độ chơi thử miễn phí bắt đầu.",0.0,0.0,0.0,0.0,0.0,0.0,2.0,0.0,0.0,0.0
7b3d5a5c-1e38-437e-ae07-5cf998b490b0,Tôi đã chơi trò chơi này hơn 3 tháng và chỉ kiếm được tối đa khoảng 80 chìa khóa.,0.0,0.0,0.0,0.0,2.0,0.0,0.0,0.0,0.0,0.0
7b43a09d-dd54-4c66-88eb-4abb8c9bbcc1,"Vui lòng sửa, vì tiền đề để có thể chơi Monopoly theo cách số hóa là rất cần thiết.",0.0,0.0,1.0,0.0,0.0,0.0,0.0,0.0,0.0,0.0
7b44d169-a476-495a-b867-821b1bdc2f63,Tôi mới mua cái này gần đây với giá bảy đô và giờ nó thậm chí còn không hoạt động.,0.0,1.0,0.0,0.0,0.0,0.0,0.0,0.0,0.0,0.0
7b78ced8-6815-485b-bb53-3e1ed5f4e85b,Tôi đã mua một số gói và một trong số đó là gói tự viết của riêng bạn.,0.0,0.0,0.0,0.0,0.0,1.0,0.0,0.0,0.0,0.0
7bae757e-91bd-42ff-a40a-1f3fb141b7e6,"Và chỉ dành cho người lớn, thật vui khi thấy tất cả chúng ta cố gắng đoán, chỉ cần thêm rượu và sự ngớ ngẩn sẽ tăng gấp bốn lần.",0.0,0.0,0.0,0.0,2.0,0.0,0.0,0.0,0.0,0.0
7bb6a8e9-b5d3-49b9-b9ae-a526403f10d6,"Tuy nhiên, khi không có giao dịch hoặc khuyến mãi cho cửa hàng thì các mặt hàng có thể khá đắt.",0.0,1.0,0.0,0.0,0.0,0.0,0.0,0.0,0.0,0.0
7bb78ed4-afd1-4204-90a6-baa51c4a1a2d,"Có rất nhiều vấn đề nhưng tổng thể quá nhiều rắc rối, tôi sẽ tìm cách được hoàn tiền.",0.0,0.0,0.0,0.0,0.0,1.0,0.0,0.0,0.0,0.0
7bbfedf8-28bc-4454-853e-720c45d2b7e8,"Đầu tiên, giới hạn tuổi không nên là 18.",0.0,0.0,0.0,0.0,0.0,0.0,0.0,0.0,1.0,0.0
7bd9db05-13c4-4045-8f8e-3ccfbf636130,Chúng tôi rất muốn sử dụng trò chơi heads up của bạn như một phần của liệu pháp của chúng tôi.,0.0,0.0,0.0,0.0,0.0,2.0,0.0,0.0,0.0,0.0
7bf2db90-bfc1-4d61-8785-d473ef7d85a8,"Nếu bạn là người sáng tạo, hãy tiếp tục làm những gì bạn đang làm!",0.0,0.0,0.0,0.0,0.0,2.0,0.0,0.0,0.0,0.0
7bfeeaa6-7cea-4c25-80f0-2b76361b28db,"Nhưng ngoại trừ điều đó, tôi thực sự yêu thích trò chơi này vì nó có hướng dẫn cụ thể dành cho cả trẻ em nhỏ, không dùng từ ngữ đao to búa lớn.",0.0,0.0,0.0,0.0,2.0,0.0,0.0,0.0,0.0,0.0
7c23392c-103f-47eb-8862-446eacacdb11,CÓ CAMERA MỚI HAY GÌ ĐÓ SAO TÔI CẢM THẤY RẤT HOANG MANG?!!!!!!,0.0,0.0,0.0,0.0,0.0,1.0,0.0,0.0,0.0,0.0
7c322b6f-0a44-4fb4-affe-45f2660fcddc,Austin sẽ đã sửa nó dù sao.,0.0,0.0,0.0,0.0,0.0,0.0,0.0,2.0,0.0,0.0
7c388f75-1e52-423d-bb74-5b948c31f517,Tôi đã sử dụng cùng một ID iTunes trong ba năm qua.,0.0,0.0,0.0,0.0,0.0,2.0,0.0,0.0,0.0,0.0
7c4261e6-7a86-48a6-a11b-5a746bdb907e,Tôi đã có sáu khách sạn ở một bên của bảng và tất cả ba người chơi khác đã bỏ qua tôi trong ba vòng chơi hoàn chỉnh xung quanh bảng.,0.0,0.0,1.0,0.0,0.0,0.0,0.0,0.0,0.0,0.0
7c75182c-965e-4624-a37e-e75901f97da9,"Vì vậy, giống như tôi đã giải thích trò chơi là một trải nghiệm vui vẻ, cũng có một số vấn đề mà tôi gặp phải với nó.",0.0,0.0,0.0,0.0,0.0,1.0,0.0,0.0,0.0,0.0
7c7f57b7-4b20-415d-9e61-c5dd4074f61f,tưởng rằng nó sẽ thêm nhiều tiếng cười vào đêm chơi game của chúng tôi và lập tức hối hận!,0.0,0.0,0.0,0.0,1.0,1.0,0.0,0.0,0.0,0.0
7c952c5a-3456-4182-93f5-963518645026,Tôi là một người chơi lâu năm yêu thích trò chơi này hơn bất kì ai nhưng tôi không ngần ngại chỉ ra sự lừa đảo đang diễn ra này.,0.0,0.0,0.0,0.0,1.0,0.0,0.0,0.0,0.0,0.0
7cc60959-cc8c-4835-b040-9e7ad41317c1,"Mỗi ngày của mỗi vòng chơi, tôi phải tiếp tục nhấn vào nút X.",0.0,0.0,0.0,1.0,0.0,0.0,0.0,0.0,0.0,0.0
7cd073e5-6bc4-471e-aa06-31e8a2ffbb7f,"Trò chuyện với những người dùng khác trong khi chơi có thể thực sự tuyệt vời, bởi vì bạn sẽ đang nói chứ không phải gõ qua màn hình.",0.0,0.0,0.0,0.0,0.0,2.0,0.0,0.0,0.0,0.0
7cdeadec-0259-4c01-9b76-8ec3cdbb6762,Vui lòng khắc phục những vấn đề này vì tôi rất muốn thử nó.,0.0,0.0,0.0,0.0,0.0,1.0,0.0,0.0,0.0,0.0
7cf1a601-43a4-4d49-8d73-30f303739637,"Tôi thực sự yêu thích trò chơi này, nhưng vấn đề là đôi khi bạn không đang chơi khi trò chơi tặng bạn miễn phí số mạng chỉ trong 30",0.0,0.0,0.0,0.0,0.0,2.0,0.0,0.0,0.0,0.0
7cf53b76-5c53-4a13-b87c-270103b52f1e,"Đây là một trò chơi rất tuyệt vời và khi tôi chơi nó cùng với bạn bè và gia đình, chúng tôi đều cười nghiêng ngả!!!",0.0,0.0,0.0,0.0,2.0,0.0,0.0,0.0,0.0,0.0
7cfc62f9-8e5a-42dc-9a53-a9df0d0963ca,6 sao chỉ để nướng bánh ngọt.,0.0,0.0,0.0,0.0,0.0,2.0,0.0,0.0,0.0,0.0
7d0d278a-5718-4ec6-826d-7f936677f534,Việc có thể tăng tốc độ trò chơi thay vì phải xem từng hoạt ảnh một sẽ rất được đánh giá cao.,0.0,0.0,0.0,2.0,0.0,0.0,0.0,0.0,0.0,0.0
7d0dca7a-935b-431f-8caa-718813e1fd8c,"Tuy nhiên, nó không miễn phí, và thuật toán rất kém.",0.0,0.0,2.0,0.0,0.0,0.0,0.0,0.0,0.0,0.0
7d24373f-164b-414b-bc9d-5084d9288aa3,Ít nhất thì trò chơi này cũng tốt hơn một chút.,0.0,0.0,0.0,0.0,0.0,2.0,0.0,0.0,0.0,0.0
7d4c2c77-f499-420c-9246-7b2f5cba0c71,Tôi đã nói với mọi người về nó để họ có thể cùng tôi chơi một trận đấu ảo!,0.0,0.0,0.0,0.0,0.0,2.0,0.0,0.0,0.0,0.0
7d67c085-30a4-4878-b747-736532af0b26,"Tôi biết rằng những người sáng tạo không thể kiểm soát những gì mọi người nói, nhưng sẽ tốt hơn nếu họ có thể bị báo cáo vì điều đó.",0.0,0.0,0.0,0.0,0.0,1.0,0.0,0.0,0.0,0.0
7d847774-41a7-48c3-a1c7-398f618a98ef,"Đừng hiểu lầm, nhân vật của họ rất tuyệt, nhưng việc giảm giá một chút cũng không hề gây hại.",0.0,1.0,0.0,0.0,0.0,0.0,0.0,0.0,0.0,0.0
7d9ac2a1-2dc6-46c7-b542-3cf63282914d,*Nhấn vào màn hình trong quá trình hoạt hình nên bỏ qua chúng.,0.0,0.0,0.0,0.0,0.0,1.0,0.0,0.0,0.0,0.0
7d9e2860-6d07-498d-920d-85c1d28a271b,"Ồ, trò chơi này kéo dài hơn tôi tưởng tượng.",0.0,0.0,0.0,0.0,0.0,2.0,0.0,0.0,0.0,0.0
7da9a351-0f1b-4bd7-99a2-f4824a00d2ad,Tiếp tục làm tốt như vậy.,0.0,0.0,0.0,0.0,0.0,2.0,0.0,0.0,0.0,0.0
7dab2fa9-bf27-43eb-a4dd-2a229a150bad,"Việc thu thập nhân vật mới, ván trượt, các mục thách thức hàng ngày, v.v. rất thú vị và thú vị.",0.0,0.0,0.0,0.0,2.0,0.0,0.0,0.0,0.0,0.0
7dfeb345-b773-4a3b-b580-ab3b7f4c4c6f,"Không quan trọng tuổi tác, nó phù hợp với mọi người!",0.0,0.0,0.0,0.0,0.0,2.0,0.0,0.0,0.0,0.0
7e1ad9d2-d2f7-4eed-aec8-8876289cb28d,Tiếp tục công việc tuyệt vời.,0.0,0.0,0.0,0.0,0.0,2.0,0.0,0.0,0.0,0.0
7e601967-6a5d-4c3f-872a-da3abe0fef89,Đó là điều duy nhất khiến tôi không đánh giá 5 sao cho nó.,0.0,0.0,0.0,0.0,0.0,1.0,0.0,0.0,0.0,0.0
7e697b58-fd84-4ada-bd6f-83d060dcd4e7,Hoặc chúng vẫn theo bạn và nổ tung trong chế độ sáng tạo trong MCPE mà tôi thích.,0.0,0.0,0.0,0.0,1.0,1.0,0.0,0.0,0.0,0.0
7e7d0b89-7eb2-4d78-81c8-e6fbac07a347,Và thật sự rất khó chịu.,0.0,0.0,0.0,0.0,0.0,1.0,0.0,0.0,0.0,0.0
7e8cc828-25fb-465a-95c5-6b13e5e80011,"Chỉ có Addons, nhưng thực tế Addons chỉ THAY THẾ các mục khác.",0.0,1.0,0.0,0.0,0.0,0.0,0.0,0.0,0.0,0.0
7e8fa67d-408c-41c6-9f2e-607b5f3726c9,Tôi chỉ muốn nhận lại bộ bài game mà tôi đã trả tiền mua (Tôi có email hóa đơn từ iTunes làm bằng chứng!).,0.0,0.0,1.0,0.0,0.0,0.0,0.0,0.0,0.0,0.0
7ee7518a-cb13-4218-90ce-4247f7d3cdfd,"Ngày sau khi tôi tải lại và đã chơi nó, nó không tải được.",0.0,0.0,0.0,0.0,1.0,0.0,0.0,0.0,0.0,0.0
7ef69466-e04d-417d-b72b-ecf101fbef9d,Chúng tôi đã mắc kẹt trong điệu nhảy phức tạp này hơn một tiếng đồng hồ trước khi quyết định từ bỏ vì sự thất vọng tột độ.,0.0,0.0,0.0,0.0,1.0,0.0,0.0,0.0,0.0,0.0
7efb1428-60c6-4fd8-9a21-00d16239f0b3,Tôi thích cách nó ghi lại để bạn luôn có thể lưu những trò vui nếu bạn muốn.,0.0,0.0,0.0,0.0,0.0,2.0,0.0,0.0,0.0,0.0
7f070ec5-f755-46be-b2ce-1b8b8c50ae3d,"Tôi yêu thích mọi loại trò chơi khớp 3, nhưng càng cố chơi cả Homescapes và Gardenscapes thì cảm thấy càng thất vọng hơn.",0.0,0.0,0.0,0.0,2.0,0.0,0.0,0.0,0.0,0.0
7f074f5d-018a-4abf-9773-678e7133760a,Tôi sẽ cho bạn xem cả hai mặt của chế độ này.,0.0,0.0,0.0,0.0,0.0,2.0,0.0,0.0,0.0,0.0
7f22f317-d65a-48f5-a593-06f6ad159e3f,Thách thức hàng ngày cá nhân & thành tựu.,0.0,0.0,0.0,0.0,0.0,2.0,0.0,0.0,0.0,0.0
7f380139-1724-4bea-9424-6997203554b7,"Nó vui nhộn, thú vị và sáng tạo.",0.0,0.0,0.0,0.0,2.0,0.0,0.0,0.0,0.0,0.0
7f801774-0460-4427-8c8f-818e267b9bf7,"Xét cho cùng, chúng tôi là bà cô của anh ấy.",0.0,0.0,0.0,0.0,0.0,2.0,0.0,0.0,0.0,0.0
7fa21dcd-8096-4db2-99d2-2f4653579cb3,"Nếu bạn bật chế độ này với xác nhận đuổi, bạn gần như có thể đảm bảo chiến thắng cho đội ngũ phi hành gia.",0.0,0.0,0.0,0.0,0.0,2.0,0.0,0.0,0.0,0.0
7faf2e59-4575-45fa-b09c-f62eb7a07490,Nó thực sự làm gián đoạn đà và bất kỳ thành tựu nào có thể đạt được.,0.0,0.0,0.0,2.0,0.0,0.0,0.0,0.0,0.0,0.0
7fb98424-8cf5-4c25-ada3-529ccf9d3ac2,hãy chắc chắn bật cài đặt video để bạn có thể ghi lại họ đang đóng kịch và bạn có thể xem lại sau.,0.0,0.0,0.0,0.0,0.0,1.0,0.0,0.0,0.0,0.0
8028edae-84c6-4da7-bd68-9aabaed37a7e,"Tôi không hiểu vì sao, chúng tôi đã trả tiền mua trò chơi rồi, nhưng họ vẫn làm như vậy.",0.0,0.0,0.0,0.0,0.0,0.0,1.0,0.0,0.0,0.0
80547c55-a79e-4494-9539-888fae6cc44d,Điều này đã gây ra rất nhiều sự tức giận cá nhân và sự thất vọng.,0.0,0.0,0.0,0.0,0.0,1.0,0.0,0.0,0.0,0.0
805b16f3-4d1e-46bb-bb40-5166f145a669,"Tôi vẫn còn một phiên bản cũ của trò chơi, không còn được phát hành nữa nhưng tôi vẫn chơi nó.",0.0,0.0,0.0,0.0,0.0,1.0,0.0,0.0,0.0,0.0
80775c86-2d64-4c52-8271-ec8248d965a4,"Những tình huống khó khăn được gọi là ""Giấc mơ xấu của Austin"" và trong 35 cấp, tôi chỉ có thể thấy một vài tình huống như vậy.",0.0,0.0,0.0,0.0,1.0,0.0,0.0,0.0,0.0,0.0
807d96d0-1a13-49df-8d41-a24ce7b0dbf9,"Trò chơi mới nhất mà tôi đã chơi, kẻ phản bội đã phá hoại O2 nhưng sau đó khi nó giảm xuống còn không, các số đã chuyển sang số âm, xuống tận -11.",0.0,0.0,0.0,0.0,1.0,0.0,0.0,0.0,0.0,0.0
8093f240-5057-4805-8bcf-400b088f695f,"Bạn thường sẽ thua chỉ với 1 nước đi, điều này thúc đẩy bạn sử dụng tiền xu để mua thêm 5 nước đi nữa.",0.0,1.0,0.0,0.0,0.0,0.0,0.0,0.0,0.0,0.0
809eab13-822f-4c6e-91cf-a950e68e0180,Trò chơi chắc chắn không đáng giá bấy nhiêu và tôi rất bức xúc vì sự lừa dối.,0.0,1.0,0.0,0.0,0.0,0.0,0.0,0.0,0.0,0.0
80a41034-7b12-46fa-a2dd-dc6ad6ff0ac1,"Tôi không thể lấy lại chúng và ""dịch vụ khách hàng"" thậm chí không hồi đáp.",0.0,0.0,0.0,0.0,0.0,1.0,0.0,0.0,0.0,0.0
80e3fa7f-2710-4719-92a7-a93644d25e5e,Tôi nhớ rằng anh ấy rất đắt và tôi sẽ thích một cách để đăng nhập vào tài khoản đó trên một thiết bị khác để tôi có thể lấy lại Tagbot.,0.0,1.0,0.0,0.0,0.0,0.0,0.0,0.0,0.0,0.0
80e66040-6fe5-47ba-83e5-4ce22f07e263,Tôi tiếp tục chơi với hy vọng nó sẽ cải thiện nhưng thật tiếc là không.,0.0,0.0,0.0,0.0,0.0,1.0,0.0,0.0,0.0,0.0
80f13db8-1314-493b-8d7f-39e718673f4f,Vui lòng tải xuống trò chơi này và giữ an toàn!,0.0,0.0,0.0,2.0,0.0,0.0,0.0,0.0,0.0,0.0
811dbcec-8880-4141-b375-1ebe998f6b56,"Khi nó giật lag, tôi chết!",0.0,0.0,0.0,0.0,0.0,1.0,0.0,0.0,0.0,0.0
814160b8-141b-45a1-8905-f33025568376,Tôi không bao giờ có thể kiếm được nhiều xu và chìa khóa như vậy.,0.0,1.0,0.0,0.0,0.0,0.0,0.0,0.0,0.0,0.0
81cd28d6-2c64-459b-bf95-65f04e13c31d,"Bạn trai tôi và tôi hoàn toàn yêu thích trò chơi này, nó là niềm vui giải trí cuối đêm của chúng tôi nhưng nó vừa mới bắt đầu bị đơ.",0.0,0.0,0.0,0.0,2.0,0.0,0.0,0.0,0.0,0.0
81e94053-6f06-4005-bf0a-9d1487a34fde,"Trước khi cập nhật:
Tôi yêu trò chơi này!",0.0,0.0,0.0,0.0,0.0,2.0,0.0,0.0,0.0,0.0
81fd9bf9-3d55-4061-8115-04a8a3512ae9,Thật vô cùng khó chịu khi muốn chơi nhưng lại phải mua tất cả mọi thứ riêng lẻ.,0.0,1.0,0.0,0.0,0.0,0.0,0.0,0.0,0.0,0.0
8205bd7f-1884-4209-8fb3-aa2b39e14243,Tôi đã mua trò chơi với giá .99 hy vọng sẽ giải trí cho gia đình trong thời gian cách ly.,0.0,1.0,0.0,0.0,0.0,0.0,0.0,0.0,0.0,0.0
8208d0d0-19a1-47ba-9f83-26bb8e123b03,Khía cạnh xã hội của Teams thật thú vị và đã thêm một tính năng độc đáo vào trò chơi tuyệt vời này.,0.0,0.0,0.0,0.0,0.0,0.0,2.0,0.0,0.0,0.0
8209244b-a693-4496-b446-b0f848d1589f,"Trái tim tôi như rơi xuống khi phát hiện họ đã cắt nguồn tài trợ cho Remlms, thế giới đa người chơi và nhiều cập nhật khác cũng đã bị ngừng cho loại thiết bị đó.",0.0,0.0,0.0,0.0,0.0,0.0,0.0,1.0,0.0,0.0
820ad100-ba61-40ad-9b7a-745dd8e61f43,"Tôi vẫn muốn gửi lời cảm ơn đến các nhà phát triển trò chơi vì đã mang lại niềm vui, và hy vọng họ sẽ chú ý đến những phàn nàn của tôi.",0.0,0.0,0.0,1.0,0.0,0.0,0.0,0.0,0.0,0.0
821489e3-13a5-47d5-b2d8-08466adca9ba,Nếu bạn có thể thực hiện cập nhật này thì điều duy nhất bạn cần cập nhật là lỗi hoặc thêm các chế độ mới.,0.0,0.0,0.0,1.0,0.0,0.0,0.0,0.0,0.0,0.0
82667e64-8579-4b72-a564-c2c0bf87591b,"Thứ hai, thế giới Nether hoàn toàn bị phá hủy và không có cách nào để đánh bại con rồng Ender mà không cần gian lận.",0.0,0.0,0.0,0.0,0.0,0.0,0.0,1.0,0.0,0.0
8283bba7-e66f-4c1a-9def-8900bb99316c,Khá khó để giết khi có người đang canh gác camera.,0.0,0.0,0.0,0.0,0.0,0.0,0.0,0.0,0.0,2.0
8283d641-5ba0-495b-a79d-0a05ead328f6,Bạn có thể chơi cùng với trẻ em hoặc có những giây phút vui vẻ khi say cùng người lớn.,0.0,0.0,0.0,0.0,2.0,0.0,0.0,0.0,0.0,0.0
828c4537-4f32-497e-b22f-3a6b9786f838,Thật là phiền phức khi phải rời khỏi một trò chơi vì không ai di chuyển hoặc trở thành những kẻ thua cuộc không biết chấp nhận.,0.0,0.0,0.0,0.0,0.0,1.0,0.0,0.0,0.0,0.0
82904c47-2e56-4f40-9a59-2e01f9304ac5,Hãy sửa cái trò chơi đáng giận này!,0.0,0.0,0.0,0.0,0.0,1.0,0.0,0.0,0.0,0.0
82a0575c-38a2-4f1b-94db-71939c321f4b,"Và nó thật ngu ngốc khiến tôi cũng phải rời đi, và tham gia một máy chủ với những người không bỏ cuộc.",0.0,0.0,0.0,0.0,0.0,1.0,0.0,0.0,0.0,0.0
82b12abd-e85f-466c-88ad-71ebc2794468,Tôi đã mất gần 3 tuần chơi khoảng 45 phút mỗi ngày để có được chiếc ván trượt mà tôi mong muốn.,0.0,0.0,0.0,0.0,2.0,0.0,0.0,0.0,0.0,0.0
82ba4340-8675-4796-a606-5c912304cc24,"Cập nhật trước đó, nơi tôi đã làm giống như vậy, chỉ cho tôi qua mà không có gì đáng lo ngại.",0.0,0.0,2.0,0.0,0.0,0.0,0.0,0.0,0.0,0.0
82c4359f-d613-4b78-a05b-a1c25abe35de,"Khi bạn nhận được một hộp bí ẩn, nó có thể cung cấp cho bạn những vật phẩm giúp bạn mở khóa nhân vật.",0.0,2.0,0.0,0.0,0.0,0.0,0.0,0.0,0.0,0.0
82d5f60f-d5b7-4425-a680-37750d195799,Lỗi màn hình đen rất phổ biến và đôi khi phòng chờ bị lỗi chuyển vào bản đồ và trò chơi trở nên không thể chơi được.,0.0,0.0,0.0,0.0,0.0,0.0,0.0,1.0,0.0,0.0
82dc9d2f-9e2c-4f49-abb1-b492e2d5137d,Và tôi thấy một số đánh giá của người dùng nói về việc chi tiêu một lượng tiền lớn.,0.0,1.0,0.0,0.0,0.0,0.0,0.0,0.0,0.0,0.0
82fe5a3c-b7ec-448c-bc84-b2f64b0a9281,Mỗi câu đố vượt qua sẽ được thưởng một ngôi sao.,0.0,0.0,0.0,0.0,0.0,0.0,0.0,0.0,0.0,2.0
8309626e-8805-4fb6-818e-d24fe25e8376,"Và rằng mọi thứ không tốn quá nhiều vàng, tôi có nghĩa là 900 cho chỉ thêm 5 nước đi nữa!",0.0,1.0,0.0,0.0,0.0,0.0,0.0,0.0,0.0,0.0
83186930-9600-4436-a007-4d852fe8cb56,"Nhưng, trò chơi tuyệt vời!",0.0,0.0,0.0,0.0,0.0,2.0,0.0,0.0,0.0,0.0
832efc72-9464-4e2a-bd8f-6bc6440f54a7,"Không đáng sợ, không chán chường, nó RẤT vui, ngay cả khi bạn không phải là một game thủ, có 99,9% cơ hội bạn sẽ yêu thích nó!",0.0,0.0,0.0,0.0,2.0,0.0,0.0,0.0,0.0,0.0
83350f0f-563a-4682-8e51-c9f55bfa67d5,Điều đó chỉ nên xảy ra nếu bạn không muốn.,0.0,0.0,0.0,0.0,0.0,0.0,0.0,2.0,0.0,0.0
8339bc1a-e07e-4a21-9c7f-f0201f9e9a6f,"Ngay cả khi những thứ này không bao giờ được thêm vào, tôi vẫn sẽ yêu trò chơi này!",0.0,0.0,0.0,0.0,1.0,0.0,0.0,0.0,0.0,0.0
8359d1e4-ebff-4d99-b543-0dec1df1b8c2,Thực sự nghĩ rằng các nhà phát triển nên có một lựa chọn để chỉ bỏ qua một nếu họ có thể thấy bạn đã cố gắng 100 lần và vẫn không thể qua màn.,0.0,0.0,0.0,0.0,1.0,0.0,0.0,0.0,0.0,0.0
837c6d87-70b2-4dcf-b651-311419b1c8c1,Quảng cáo gì thế kia trên trời?!,0.0,0.0,0.0,0.0,0.0,0.0,0.0,1.0,0.0,0.0
83905629-6a97-4348-88e4-0521b60d2242,"Tôi thậm chí đã chờ một chút để xem nếu nó sẽ quay trở lại bình thường nhưng đoán xem, nó không hề.",0.0,0.0,0.0,0.0,0.0,0.0,2.0,0.0,0.0,0.0
83a37ca1-ee53-4ade-985d-34cb24f9823a,Làm ơn hãy giảm giá chúng.,0.0,1.0,0.0,0.0,0.0,0.0,0.0,0.0,0.0,0.0
83c56ef7-5910-4bd9-af0d-a262d79ad161,"Một điều nữa, có thể đây là một lỗi hoặc gì đó, nhưng tiền xu của tôi đã đi đâu?",0.0,0.0,1.0,0.0,0.0,0.0,0.0,0.0,0.0,0.0
83ca1098-4289-47a6-a746-8aef2509a06b,Chỉ có một vấn đề.,0.0,0.0,0.0,0.0,0.0,1.0,0.0,0.0,0.0,0.0
83d30938-e28d-49a6-b5f0-29a7575a1e88,Trò chơi yêu thích của gia đình chúng tôi là diễn lại và bắt chước.,0.0,0.0,2.0,0.0,0.0,0.0,0.0,0.0,0.0,0.0
83e27469-dd1c-4f45-b05f-d2982fc8401c,Xin đừng cướp đi sự đơn giản của Minecraft.,0.0,0.0,0.0,0.0,0.0,0.0,0.0,1.0,0.0,0.0
83f87c09-3122-494b-a259-4e574a15a27e,"Thích: Báo cáo xác chết, gọi cuộc họp khẩn cấp, và nhiều hơn thế nữa!",0.0,0.0,0.0,0.0,0.0,0.0,2.0,0.0,0.0,0.0
84134324-0863-44ea-bc68-6cfbcf7d837d,Tôi sẽ phải đợi bao lâu cho đến khi nó hoàn thành?,0.0,0.0,0.0,1.0,0.0,0.0,0.0,0.0,0.0,0.0
