sentence_id,review,aesthetics,cost,effectiveness,efficiency,enjoyability,general,learnability,reliability,safety,security
3da6f6aa-16c2-4d29-bc02-82a145041f4d,"Tóm lại, đây là trò chơi tốt nhất trên App Store hiện nay, 10/10, 100%, 5 sao, nó thực sự tuyệt vời.",0.0,0.0,0.0,0.0,0.0,2.0,0.0,0.0,0.0,0.0
3db2113b-8076-427a-bc96-6c7a6e348c94,"Tôi đã chiến thắng được 2 giờ, chơi liên tục trong khoảng thời gian đó và chỉ vượt qua được 2 cấp độ.",0.0,0.0,0.0,0.0,2.0,0.0,0.0,0.0,0.0,0.0
3df81c6e-a22d-41e8-b6b1-75dd68840bf6,"Sáng nay tôi đã chơi cùng em gái nhỏ của mình và dạy cô ấy cách chơi, nghe thú vị phải không?",0.0,0.0,0.0,0.0,2.0,0.0,0.0,0.0,0.0,0.0
3e061a6d-dbec-4892-a3e3-f0bdeba6aac2,Nhưng các nhiệm vụ mất hơn 6 và thậm chí nhiều sao hơn nữa để hoàn thành.,0.0,0.0,0.0,0.0,0.0,2.0,0.0,0.0,0.0,0.0
3e0f19f3-730d-4c7f-ac46-d39e6b302dcc,Tôi sẽ chờ đợi phản hồi của bạn.,0.0,0.0,0.0,0.0,0.0,0.0,0.0,0.0,0.0,2.0
3e13d27c-9428-4492-84fd-baff309f7a76,Tôi đã có nó 2 ngày và tôi đã chơi hơn 10 trận 💖 thật tuyệt vời khi họ thêm các mục tùy chỉnh mà bạn có thể thay đổi.,0.0,0.0,0.0,0.0,0.0,2.0,0.0,0.0,0.0,0.0
3e86cc13-9edd-4f4e-a600-07adba5c4168,Điều đó rõ ràng đến đau đớn.,0.0,0.0,0.0,0.0,0.0,1.0,0.0,0.0,0.0,0.0
3e87b3e3-2d56-441a-a54a-131d16029d5d,"Dựa trên các đánh giá trước đó, nó khiến tôi không muốn mua bất kỳ bộ bài nào.",0.0,1.0,0.0,0.0,0.0,0.0,0.0,0.0,0.0,0.0
3ea2da39-559b-48b3-8f12-81581e96eb2a,"Một trong những vấn đề là hacker (có lẽ bạn đã có hành động gì đó về vấn đề này rồi, xin lỗi nếu bạn đã làm) và rất nhiều lỗi kỹ thuật.",0.0,0.0,0.0,0.0,2.0,0.0,0.0,0.0,0.0,0.0
3eacb750-9b8e-4ed1-83a4-4e38825c6d18,"Ví dụ, nếu bạn thêm quá nhiều mobs trong chế độ sáng tạo, trò chơi của bạn sẽ bị giật lag.",0.0,0.0,1.0,0.0,0.0,0.0,0.0,0.0,0.0,0.0
3eb3bf96-5c06-4dc3-976c-cd6a595ccd57,Ứng dụng này chỉ gây rắc rối cho tôi và tôi muốn mọi người chú ý đến điều này.,0.0,0.0,0.0,0.0,0.0,1.0,0.0,0.0,0.0,0.0
3eb42d2c-1b52-4f51-9f20-a162cff27372,Một vấn đề khác là bản cập nhật mới (theo ý kiến của tôi) đã làm cho trò chơi trông rất cũ kỹ và trẻ con.,0.0,0.0,0.0,0.0,0.0,0.0,0.0,1.0,0.0,0.0
3edd3976-35cd-431a-9705-4d0bfda7737c,Âm nhạc chỉ đơn giản là tuyệt vời.,0.0,0.0,0.0,0.0,2.0,2.0,0.0,0.0,0.0,0.0
3ef63dd2-c4f3-4e63-95bf-e901974a661b,"Từ thức ăn đến các khối, từ động vật đến vũ khí, tôi không bao giờ muốn bị một con quái vật bắt gặp trong chế độ sinh tồn.",0.0,0.0,0.0,0.0,0.0,2.0,0.0,0.0,0.0,0.0
3efb7a77-f647-4181-ae17-528313cb786d,Chơi trên ứng dụng dễ dàng hơn nhiều vì nó đếm tiền cho bạn và rất gọn gàng.,0.0,0.0,2.0,0.0,0.0,0.0,0.0,0.0,0.0,0.0
3f191469-c6f5-4b5d-b3f3-b1b1e302cd91,"Một số lá bài không hoạt động như mong đợi, như những lá bài yêu cầu thanh toán giữa các người chơi, nhưng hầu hết các lỗi lớn đã được khắc phục.",0.0,1.0,0.0,0.0,0.0,0.0,0.0,0.0,0.0,0.0
3f29cbbb-16ad-4bc7-8f70-a1c0a0c8cba6,"Đầu tiên, nó thiếu một số cụm từ và câu hỏi quan trọng.",0.0,0.0,0.0,0.0,0.0,1.0,0.0,0.0,0.0,0.0
3f5015c6-2c9f-44c0-b21b-25088f3513db,Cảm ơn bạn đã tạo ra trò chơi này!,0.0,0.0,0.0,0.0,0.0,2.0,0.0,0.0,0.0,0.0
3f58dcac-89e3-43c4-8f7f-44a0c9083980,Tôi có một iPhone 7 vì vậy tôi cho rằng tôi nên có thể chơi trò này trên điện thoại của mình.,0.0,0.0,0.0,0.0,0.0,2.0,0.0,0.0,0.0,0.0
3f61ff63-5e14-49a8-8548-78852184c4c7,"Nó làm cho trò chơi trở nên ít vui hơn một chút, nhưng vẫn rất tuyệt.",0.0,0.0,0.0,0.0,2.0,0.0,0.0,0.0,0.0,0.0
3f730862-bf88-46c4-8646-9b3d2bbedec2,Ý tôi là tôi đang cố gắng tạo khuôn mặt bằng văn bản nhưng nó không cho phép tôi.,0.0,0.0,0.0,1.0,0.0,0.0,0.0,0.0,0.0,0.0
3f755cb5-d834-4401-b82d-c963ef95c94a,"Tôi cảm thấy nó thách thức, nhưng không gây nản lòng, rất thỏa mãn.",0.0,0.0,0.0,0.0,2.0,0.0,0.0,0.0,0.0,0.0
3f980563-c885-4e5f-8201-df179e64a50f,Tôi đã mua một số bộ bài và giờ chúng không tải xuống lại được.,0.0,0.0,1.0,0.0,0.0,0.0,0.0,0.0,0.0,0.0
3f9b88ab-af23-4dde-8b88-38bd962d388f,"Công việc tuyệt vời, Mojang, và Notch, cùng tất cả mọi người khác.",0.0,0.0,0.0,0.0,2.0,0.0,0.0,0.0,0.0,0.0
3fa16924-d54f-43e3-bcd8-e840cbc0d28e,"Tôi cũng đã mua các bộ, nhưng không thể tận hưởng chúng vì phải thiết lập lại mọi thứ quá thường xuyên.",0.0,0.0,0.0,0.0,0.0,1.0,0.0,0.0,0.0,0.0
3fb1bf29-038a-4421-9f7d-2657687b93f5,"Tôi yêu trò chơi này, nhưng tôi đã dừng chơi nó một thời gian và giờ khi tôi quay lại, quá nhiều thứ đã thay đổi.",0.0,0.0,0.0,0.0,0.0,1.0,0.0,0.0,0.0,0.0
3fd5b850-59ab-4d17-a1c8-70393fbde6de,"Lại yêu thích trò chơi này... Tôi chỉ muốn nó trở thành trò chơi tốt nhất, hoạt động nhất và vui nhất mà nó có thể!",0.0,0.0,0.0,0.0,2.0,0.0,0.0,0.0,0.0,0.0
3fee8b8c-7510-44ed-b33c-9dbf78685442,"Một khi bạn bắt đầu chơi trò chơi, nó thật tuyệt vời, nhưng sau một thời gian, nó trở nên nhàm chán.",0.0,0.0,0.0,0.0,0.0,2.0,0.0,0.0,0.0,0.0
4021756b-ffa2-418b-92e2-c6dee86a1267,Điều duy nhất tôi thấy thay đổi là màn hình tải.,1.0,0.0,0.0,0.0,0.0,0.0,0.0,0.0,0.0,0.0
402618c3-0436-4074-b152-5e81f0108493,"Ngoài ra, mỗi lần bạn mua gói bài, nó đều đi kèm với rất nhiều bộ bài tự xây dựng.",0.0,0.0,0.0,0.0,0.0,2.0,0.0,0.0,0.0,0.0
40368083-3f13-4a55-99b4-d48154b62843,"Lượt tiếp theo của tôi, tôi thực sự cầu nguyện đến Chúa để không lắc được số 2 hoặc số 3 do họ đã có khách sạn ... Tôi lắc được số 2 và phá sản.",0.0,0.0,0.0,0.0,0.0,0.0,0.0,0.0,0.0,2.0
404b6345-4841-4976-aeab-eef27c853c3a,Tôi chơi nó một hoặc hai giờ rồi tắt nó và không chạm vào nó nữa.,0.0,0.0,0.0,0.0,0.0,2.0,0.0,0.0,0.0,0.0
405ace4c-b2ce-4230-ae49-82f792ef9dd5,"Mặc dù nhà phát triển không thể kiểm soát điều này, nhưng nó vẫn làm trò chơi trở nên trải nghiệm tồi tệ cho nhiều người chơi.",0.0,0.0,0.0,0.0,0.0,0.0,0.0,1.0,0.0,0.0
406cbf56-9db0-4982-b98a-7339a963d8ff,"Trò chơi nào đó đã đăng tôi ra khỏi tài khoản Microsoft của mình, và tôi không nhớ email cho nó.",0.0,0.0,1.0,0.0,0.0,0.0,0.0,0.0,0.0,0.0
408297c4-b1c6-435c-9444-9c558e4c219d,Trò chơi khá dễ chơi và thú vị.,0.0,0.0,0.0,0.0,2.0,0.0,0.0,0.0,0.0,0.0
4088c8ae-8b14-42b9-9da0-5de4bcab8db0,Giá trị thực sự là hơn 100 đô chỉ với 20 đô nên tôi nghĩ rằng mình đã mua được một món hời tuyệt vời!,0.0,0.0,0.0,0.0,0.0,0.0,1.0,0.0,0.0,0.0
409c01d5-f430-45b3-b86f-e191a2cd4104,"Cuối cùng, lý do chính tôi mua phiên bản này là vì tôi hy vọng AI giao dịch sẽ tốt hơn, nhưng thực tế thì không phải vậy.",0.0,0.0,0.0,0.0,0.0,2.0,0.0,0.0,0.0,0.0
40b37191-e741-4ba1-8018-47e7379095bd,"Ví dụ, nếu giao dịch thẻ, lý do cho các giao dịch hoặc từ chối, v.v.",0.0,0.0,0.0,0.0,0.0,2.0,0.0,0.0,0.0,0.0
40b396cf-6d4d-43bf-8104-c656a5b89cf3,Tôi cũng rất tức giận với việc những người đồng đội chỉ đơn giản rời đi khi cuối cùng tôi trở thành kẻ phá rối cùng với BFF của mình.,0.0,0.0,0.0,0.0,0.0,0.0,0.0,1.0,0.0,0.0
410e3cfb-b010-4c68-86f6-f164e71f88c6,Trò chơi này rất tuyệt để giết thời gian khi đang xếp hàng ở bất kì đâu hoặc khi đang chờ để đặt món ăn tại nhà hàng hoặc quán ăn yêu thích của bạn.,0.0,0.0,0.0,0.0,1.0,1.0,0.0,0.0,0.0,0.0
4149ddcf-3433-48f5-91d6-236763e03ca6,Đề xuất đầu tiên là giảm giá cho các hình đại diện.,0.0,2.0,0.0,0.0,0.0,0.0,0.0,0.0,0.0,0.0
414e3dd4-6dbf-4b32-81c9-fb80b01c48aa,"Và nếu mọi thứ được thực hiện đúng cách và rất sạch sẽ, tôi thậm chí còn có thể xem xét việc không thể tưởng tượng được: Chi trả cho một số bản đồ và huy hiệu.",0.0,0.0,0.0,0.0,2.0,0.0,0.0,0.0,0.0,0.0
4151f068-1770-46d1-af92-7b0874b6bad2,Tôi bị mắc kẹt ở một số màn hình và bị đá ra.,0.0,0.0,0.0,0.0,0.0,0.0,0.0,1.0,0.0,0.0
4158a5e0-0401-4a50-93e1-2de3d552b098,"Theo ý kiến của tôi, đồ họa cũng kém hơn.",1.0,0.0,0.0,0.0,0.0,0.0,0.0,0.0,0.0,0.0
415ea456-a6f2-49e3-900f-a76c6c96a812,Tôi có thể nói mãi nhưng đây là những lý do chính tại sao tôi chỉ đánh giá nó một sao,0.0,0.0,0.0,0.0,1.0,0.0,0.0,0.0,0.0,0.0
41bd392f-8e94-4694-b3ae-7a8d7165ca99,Tôi đã giải quyết điều này riêng tư với những điều cụ thể trước khi quay lại và viết lại đánh giá.,0.0,0.0,0.0,0.0,0.0,0.0,0.0,0.0,0.0,2.0
41c40376-562a-449d-844c-7bb099190eb7,Bạn sẽ phải chờ đợi kết quả như một vệ sĩ ngăn bạn không được vào câu lạc bộ.,0.0,0.0,0.0,0.0,0.0,2.0,0.0,0.0,0.0,0.0
41d36e53-3b7e-4d10-9357-4b484677cc65,Chỉ cần gắn chặt vào ý tưởng về việc cải tạo nhà cửa thay vì mở rộng ra những dòng chuyện khác kéo dài quá lâu.,0.0,0.0,0.0,0.0,0.0,2.0,0.0,0.0,0.0,0.0
41d417ca-89d9-419f-ada2-26b1305e030f,Gần đây tôi đã mua một bộ bài tùy chỉnh và thêm vào một danh sách dài.,0.0,2.0,0.0,0.0,0.0,0.0,0.0,0.0,0.0,0.0
41dd92d4-2f93-45c0-b3c7-7e348f0f35ef,"Đây là một vấn đề lớn, khiến tôi cảm thấy như tôi không nên trả tiền để mua trò chơi này.",0.0,0.0,0.0,0.0,0.0,1.0,0.0,0.0,0.0,0.0
41e0b353-8343-4400-8172-90c8d4e6fdbf,"Những ngày tôi và bọn bạn, thức cả đêm, chơi game, xây dựng bất cứ thứ gì chúng tôi có thể.",0.0,0.0,0.0,0.0,2.0,0.0,0.0,0.0,0.0,0.0
41ef598d-89d6-424e-a8ab-68330be748c8,"Ngoài ra, giao diện người dùng không thân thiện với màn hình cảm ứng như trong phiên bản alpha và beta.",0.0,0.0,0.0,1.0,0.0,0.0,0.0,0.0,0.0,0.0
421b0aa4-1dc0-4997-8183-1a1ccd690279,"Vì thế, tôi đã bắt đầu chơi trò chơi này trở lại trong thời gian cách ly và tôi đã gặp nhiều vấn đề với trò chơi.",0.0,0.0,0.0,1.0,0.0,0.0,0.0,0.0,0.0,0.0
421cbdf2-3685-49e7-81d4-4a227bc1e7a8,Nó thật vui và có thể gây nghiện một chút.,0.0,0.0,0.0,0.0,2.0,0.0,0.0,0.0,0.0,0.0
425570da-6918-41fa-b73a-5bf9173bed5d,"Tôi nhận thấy vào cuối vòng chơi, nó đã hiển thị một video trực tiếp được quay từ camera selfie ở mặt trước của điện thoại của tôi.",0.0,0.0,0.0,0.0,0.0,0.0,0.0,0.0,0.0,1.0
4262885e-39a5-4bbc-95e7-6ec33a68397d,Tôi biết bạn có thể dễ dàng nhận được các mod cho những thứ này nhưng một số lại tốn tiền.,0.0,2.0,2.0,0.0,0.0,0.0,0.0,0.0,0.0,0.0
426a5056-2969-4deb-a379-c3d7da73ab45,Có ý nghĩa gì khi chơi một trò chơi có khả năng bị đứng máy vì lỗi?,0.0,0.0,0.0,0.0,0.0,1.0,0.0,0.0,0.0,0.0
42ac0242-aa6e-428f-9c90-8eaeb48324db,"Vì vậy, xin vui lòng, xin vui lòng, xin VUI LÒNG làm gì đó về nó!",0.0,0.0,0.0,0.0,0.0,2.0,0.0,0.0,0.0,0.0
42c130c4-a8d7-4711-bee3-389c11c5d0e8,"Tôi luôn thích nhớ lại năm 2011, lúc tôi thưởng thức trò chơi này trên chiếc máy tính cũ ở nhà ông bà.",0.0,0.0,0.0,0.0,2.0,0.0,0.0,0.0,0.0,0.0
42c5f2be-23d4-4f38-b4c8-4d027f9b34ff,"Một điều khác cũng xảy ra thường xuyên là khi tôi làm mới các máy chủ, không có máy chủ nào sẵn có!",0.0,0.0,0.0,0.0,0.0,1.0,0.0,1.0,0.0,0.0
42dd8c11-7a10-455e-bd13-0c209b05a916,"Vì vậy, tổng thể, trò chơi này khá tốt, nhưng nó có thể cần một số cải tiến.",0.0,0.0,0.0,0.0,0.0,2.0,0.0,0.0,0.0,0.0
42e030ae-61b5-4fa2-8042-d622c2f90db5,Tôi biết rằng nhiều người có ý kiến về điều này (hầu hết đều tích cực) nên tôi chỉ nghĩ rằng tôi nên lan truyền lời đồn này thêm nữa.,0.0,0.0,0.0,0.0,0.0,2.0,0.0,0.0,0.0,0.0
42e6363d-6e20-4012-9d9b-d9a902f291bf,Tôi nghĩ rằng trò chơi có thể được cải thiện một chút nếu xét đến việc bạn phải trả tiền để mở khóa nhân vật và bảng mới.,0.0,0.0,0.0,0.0,0.0,1.0,0.0,0.0,0.0,0.0
42f59f86-2ada-490f-a5d9-f17ea37c528a,"Tắt chức năng cũng sẽ khá tốt, đặc biệt là cho những trò chơi ngắn.",0.0,0.0,0.0,0.0,0.0,2.0,0.0,0.0,0.0,0.0
431b5604-5f7a-4e40-ac99-64321f91c0a1,"Mặc dù trò chơi này rất vui, nhưng nó không đáng để tôi phải sợ hãi mỗi khi bạn bè tôi không muốn chơi.",0.0,0.0,0.0,0.0,2.0,0.0,0.0,0.0,0.0,0.0
431db870-82aa-4c4d-83a6-c9a4d33d6023,Đây là một trò chơi rất phổ biến đã thành công tìm đến gần như mọi thiết bị của mọi người vào một thời điểm nào đó.,0.0,0.0,0.0,0.0,2.0,0.0,0.0,0.0,0.0,0.0
435751cc-46cc-4e16-8b15-b32d3d729bea,Tôi không nghĩ rằng đó là một vấn đề lớn ban đầu cho đến khi tôi gặp phải bức tường bất động.,0.0,0.0,2.0,0.0,0.0,0.0,0.0,0.0,0.0,0.0
43660041-988d-4e6a-b566-b69a19c43587,"Không cần phải sắp xếp tiền, hay đối phó với thẻ, nó đơn giản QUÁ DỄ DÀNG!!!!",0.0,2.0,0.0,0.0,0.0,0.0,0.0,0.0,0.0,0.0
436b175e-d42f-4a42-93de-a9f9a4b75db2,Đây là một trải nghiệm học tập tuyệt vời và công cụ cho một số lớp học.,0.0,0.0,0.0,0.0,0.0,0.0,2.0,0.0,0.0,0.0
436e3c80-700b-475b-b045-ef208dcff98b,Khiến bạn cảm thấy gần như không đáng với tất cả những lần bạn đã phải chơi để vượt qua một màn đố duy nhất.,0.0,0.0,0.0,0.0,1.0,0.0,0.0,0.0,0.0,0.0
438a006e-fc61-47d2-80ab-7262abbdaf96,Trò chơi này đã trở nên khá chán chường vì bản cập nhật và tôi nghĩ rằng nó vẫn sẽ ổn mà không cần bản cập nhật mới.,0.0,0.0,0.0,0.0,0.0,0.0,1.0,0.0,0.0,0.0
43971707-2d5a-45f5-83fa-8c2a5083c5ae,"Tôi đã chơi trò chơi này một thời gian và nó rất thú vị, thỉnh thoảng thách thức, và là cách tốt để giết thời gian.",0.0,0.0,0.0,0.0,2.0,0.0,2.0,0.0,0.0,0.0
439819c1-55e5-4158-ad7a-f6d21399c2d9,Tôi rất muốn thấy tất cả những điều này được thêm vào chế độ chơi miễn phí.,0.0,0.0,2.0,0.0,0.0,0.0,0.0,0.0,0.0,0.0
43e6f101-60a1-4081-8060-193470eb239a,"Kể từ bản cập nhật mới, trò chơi đang bị đóng băng ở màn hình hết giờ.",0.0,0.0,0.0,0.0,0.0,0.0,0.0,0.0,1.0,0.0
440b4659-238b-4933-8a5c-67fbcce58417,Tôi đã chơi trò chơi này kể từ khi tôi 5 tuổi và TÔI YÊU NÓ.,0.0,0.0,0.0,2.0,0.0,0.0,0.0,0.0,0.0,0.0
4423201c-d469-4bce-b31c-bee901fcdf21,Tôi thực sự mong muốn bạn thêm tính năng kết bạn trong trò chơi!!,0.0,0.0,0.0,0.0,0.0,2.0,0.0,0.0,0.0,0.0
4426b3d8-2b7b-44f0-a42f-ddc6cfab62e0,"Tôi yêu Subway Surfers, tôi đã chơi nó từ khi tôi năm tuổi.",0.0,0.0,0.0,0.0,2.0,0.0,0.0,0.0,0.0,0.0
443c6d85-9d1d-4ba3-b12c-c948336edc9c,Người chơi khác thường cũng giỏi không kém.,0.0,0.0,0.0,0.0,0.0,2.0,0.0,0.0,0.0,0.0
444a4341-642d-48ab-b229-9fe7a0002dd8,"Bạn nên tạo ra cách thức để khi bạn lấy điện thoại ra, bạn có thể chơi trên đó.",0.0,0.0,0.0,0.0,0.0,2.0,0.0,0.0,0.0,0.0
44610116-ff22-4e11-b0c7-951fb84fece0,Và tôi có khá nhiều vật phẩm tốt trong chế độ sinh tồn.,0.0,0.0,0.0,0.0,0.0,0.0,1.0,0.0,0.0,0.0
446ffa5f-22c6-402d-b82a-3e154c7c6ecc,Tôi yêu trò chơi này!,0.0,0.0,0.0,0.0,2.0,0.0,0.0,0.0,0.0,0.0
447ced6e-3edb-44a5-b2a6-de4ad1599928,"Trò chơi rất vui, và sau khi đọc nhiều đánh giá, tôi nghĩ rằng trò chơi nên được cập nhật và nên giải quyết những vấn đề này.",0.0,0.0,2.0,0.0,0.0,0.0,0.0,0.0,0.0,0.0
44cf1dbb-615c-44d3-a322-500fe213e7c7,"Thỉnh thoảng, các hình đại diện bị lỗi xuyên qua/tới tường, hoặc đi vào các khu vực ngoài giới hạn.",0.0,0.0,0.0,0.0,2.0,0.0,0.0,0.0,0.0,0.0
44d0fa0d-f535-4f0c-ac2b-953b75049bd4,"Tôi thực sự nghĩ rằng việc chúng được gọi là ""Cấp độ khó"" giúp chúng ta chuẩn bị tốt hơn, và chắc chắn số lượng tiền xu ở đó đáng giá.",0.0,0.0,0.0,2.0,0.0,0.0,0.0,0.0,0.0,0.0
44e3ad48-5d0d-4b0c-9c61-8329e7d96323,Ý tôi là mất bao lâu để thực sự đi một vòng quanh thế giới?,0.0,0.0,0.0,0.0,0.0,1.0,0.0,0.0,0.0,0.0
4505e952-3fb9-4290-854d-bf40e0b84ae6,Mặc dù tôi cảm thấy mình chỉ trở nên khá giỏi gần đây nhưng tôi nghĩ rằng trò chơi này thực sự rất vui.,0.0,0.0,0.0,0.0,2.0,0.0,0.0,0.0,0.0,0.0
450e953b-ee8e-43bf-9adb-a37bade14ca7,Tôi yêu trò chơi này!,0.0,0.0,0.0,0.0,2.0,0.0,0.0,0.0,0.0,0.0
451b5ccc-bfbc-4343-a010-264b18d157b2,Tôi có một số gợi ý về những thứ bạn có thể thêm hoặc sửa.,0.0,0.0,0.0,0.0,2.0,0.0,0.0,0.0,0.0,0.0
451c9f8b-44ce-468a-87c3-19ac696ee1d3,Nó vẫn vui để chơi ngoại trừ việc tôi hiếm khi chơi nó nữa.,0.0,0.0,0.0,0.0,2.0,0.0,0.0,0.0,0.0,0.0
454b33fc-d2c7-4537-934a-710ecd69d4f8,"Ngoài ra, số lượng nước đi được cung cấp trong mỗi cấp độ cũng thật là vô lý.",0.0,0.0,0.0,0.0,0.0,1.0,0.0,0.0,0.0,0.0
455d8f83-93e9-4a15-a597-3daeb2504027,"TL/DR

Ứng dụng cũ tốt hơn nhiều.",0.0,0.0,1.0,0.0,0.0,0.0,0.0,0.0,0.0,0.0
456ab238-f1a9-4ef0-8668-93638325898c,"Đôi khi nó sẽ bắt đầu đóng băng và bạn phải khởi động lại ứng dụng, theo ý kiến của tôi thì điều đó hơi phiền phức.",0.0,0.0,0.0,1.0,0.0,0.0,0.0,0.0,0.0,0.0
45737aa4-38b3-4812-8c7b-6a95cb136dca,Chúc phúc và bình an cho tất cả các bạn!,0.0,0.0,0.0,0.0,0.0,2.0,0.0,0.0,0.0,0.0
457be43d-84a4-45d6-a20e-399fdf67b3ea,Hình ảnh động cũng quá dài và thật khó chịu khi cố gắng chơi cùng người khác trực tuyến.,1.0,0.0,0.0,0.0,0.0,0.0,0.0,0.0,0.0,0.0
45845bd6-5d02-4f48-954b-ce533e0f584d,Luôn là thời gian vui vẻ và đôi khi ngay cả người phục vụ cũng tham gia chơi.,0.0,0.0,0.0,0.0,0.0,2.0,0.0,0.0,0.0,0.0
45872fd9-fc28-467e-a340-b3e0be2bd453,Tôi và có thể một số người khác đều đồng ý rằng bạn nên thay đổi trò chơi thành một cái gì đó khác.,0.0,0.0,0.0,0.0,0.0,1.0,0.0,0.0,0.0,0.0
45985f90-693a-4284-8911-74b5c980083e,"Sau đó, tôi quay lại sau và nó báo rằng tôi có 93 chìa khóa...",0.0,0.0,0.0,0.0,0.0,0.0,1.0,0.0,0.0,0.0
460ae835-f55d-4512-ae5b-df410e205dee,Nó trở nên cực kỳ sâu sắc và những thứ như vậy và không nghe có vẻ đúng.,0.0,0.0,0.0,0.0,2.0,0.0,0.0,0.0,0.0,0.0
4649db40-10bf-4785-bc04-d84794399161,"Hãy nhớ rằng, tôi đã thử mọi cách.",0.0,0.0,0.0,0.0,0.0,1.0,0.0,0.0,0.0,0.0
467c5d43-9df9-424f-9808-1ea9b4d71560,"Bằng cách thực hiện tất cả những cải tiến này, tôi nghĩ bạn có thể khiến tôi đánh giá cho bạn năm sao.",0.0,0.0,0.0,0.0,0.0,2.0,0.0,0.0,0.0,0.0
468f621a-3a69-4a84-b689-586da7ee692a,"Vậy, tại sao lại có xếp hạng trung bình?",0.0,0.0,0.0,0.0,0.0,1.0,0.0,0.0,0.0,0.0
4691958f-cf43-4182-ad7f-13a73b6aa871,Tôi đã để nó trong mười phút và nó vẫn không tải được.,0.0,0.0,0.0,0.0,0.0,1.0,0.0,0.0,0.0,0.0
46a78a3d-3579-4f75-a5d5-049e5cc76e3b,Tôi đã chơi trò chơi này kể từ khi nó được phát hành.,0.0,0.0,2.0,0.0,0.0,0.0,0.0,0.0,0.0,0.0
47432a57-ee52-4fec-b0d1-f79524325de3,Các lực lượng tăng cường ở đó để phá hủy trò chơi của bạn.,0.0,0.0,0.0,1.0,0.0,0.0,0.0,0.0,0.0,0.0
47475b0b-0507-437d-a32f-d1389a97fdc8,Tôi cảm thấy như một diễn đàn trò chuyện mở sẽ cho phép sự linh hoạt hơn trong trò chơi.,0.0,0.0,0.0,0.0,0.0,2.0,0.0,0.0,0.0,0.0
476a6482-4700-4678-bb22-a474653882cd,Có thể bạn có thể thêm một tính năng cho phép đăng nhập bằng một tài khoản khác.,0.0,0.0,2.0,0.0,0.0,0.0,0.0,0.0,0.0,0.0
478cdfd2-2c92-4174-b45c-41b72079b103,Bạn không cần một ngôi sao để thực hiện mỗi cuộc gọi và 2 ngôi sao để tập dượt.,0.0,0.0,1.0,0.0,0.0,0.0,0.0,0.0,0.0,0.0
479d254b-942f-4e14-8e51-7329c9eceb07,Tôi cũng không thể chịu đựng khả năng từ tính trong chúng.,0.0,0.0,0.0,1.0,0.0,0.0,0.0,0.0,0.0,0.0
47a2e3c0-26e5-4d3c-b77b-6313da92deda,Tôi cũng không thích việc chúng ta chỉ có năm mạng.,0.0,0.0,0.0,0.0,0.0,0.0,1.0,0.0,0.0,0.0
47cfa335-34b1-44c2-a380-c2e9fa78635d,"Khi tôi còn là một đứa trẻ, tôi rất thích chơi cờ tỷ phú, nhưng giờ đây khi tôi đã lớn, tôi không còn nhiều người để chơi cùng.",0.0,0.0,0.0,0.0,2.0,0.0,0.0,0.0,0.0,0.0
47f1239b-1409-42d4-a9ce-b07eb9179e0b,Tôi không thể đủ với Homescapes.,0.0,0.0,0.0,0.0,0.0,1.0,0.0,0.0,0.0,0.0
47f20307-ea1c-4826-bf47-1eb65c423f75,"Ngay cả khi tôi mở menu hành trang, skin tùy chỉnh của tôi vẫn còn đó.",0.0,0.0,0.0,2.0,0.0,0.0,0.0,0.0,0.0,0.0
48376d94-d595-4b13-967f-b5f63b8c9155,"Tôi vừa mới kết thúc một trận chơi & tôi đã làm phá sản tất cả các người chơi khác rồi nó công bố người chơi phá sản cuối cùng là ""người chiến thắng!"".",0.0,0.0,0.0,0.0,1.0,0.0,0.0,0.0,0.0,0.0
484b23ad-92dd-4840-a5a7-393e25dd7586,Thiết kế rất tuyệt vời.,0.0,0.0,0.0,0.0,0.0,0.0,0.0,2.0,0.0,0.0
486977e5-11bb-45b0-8b91-ff46c0c99a52,Nhưng mất khoảng 10 phút cho tôi để nhận được nhân vật này và sử dụng nó lần đầu tiên vì lần mua sắm này.,0.0,0.0,0.0,2.0,0.0,0.0,0.0,0.0,0.0,0.0
48c61fa2-4b06-466f-91d0-d8bf645f2994,Gợi ý cuối cùng là thêm nhiều nhiệm vụ hơn vào trò chơi.,0.0,0.0,0.0,0.0,2.0,0.0,0.0,0.0,0.0,0.0
48d588fe-f40c-406b-bd5f-57a5de09d7c3,"Bây giờ chúng ta phải ở nhà, chúng ta cần những trò chơi gắn kết làm cho chúng ta cảm thấy vui chỉ vì được làm những điều ngớ ngẩn.",0.0,0.0,0.0,0.0,2.0,0.0,0.0,0.0,0.0,0.0
48dd80ad-4e3f-4a79-9eb0-8c7ca17267c6,"Nhưng tất nhiên, tôi thì lại thích phiên bản Java hơn, tất nhiên rồi.",0.0,0.0,0.0,0.0,0.0,2.0,0.0,0.0,0.0,0.0
4903115f-2152-4a00-ba29-d76c753fc321,"Đầu tiên, họ ngừng cập nhật phiên bản cũ để ép mọi người phải mua phiên bản mới hơn, theo ý kiến của tôi, phiên bản đó tệ hơn.",0.0,0.0,0.0,1.0,0.0,0.0,0.0,0.0,0.0,0.0
49372c71-53e7-4b1c-b5bd-30d91860e28a,"Tuy nhiên, có một lỗi nhỏ.",0.0,0.0,0.0,0.0,0.0,0.0,0.0,1.0,0.0,0.0
49462230-6a7c-4285-b6e7-510ac570a6a7,Không tuyệt vời nhưng nó tốt.,0.0,0.0,0.0,0.0,0.0,2.0,0.0,0.0,0.0,0.0
496931d2-710e-45f5-9977-dc8085e8e3ce,Ứng dụng này THẬT SỰ cần bắt đầu tạo ra những cập nhật tốt hơn và không làm tồi tệ hơn trò chơi.,0.0,0.0,0.0,1.0,0.0,0.0,0.0,0.0,0.0,0.0
496cf8b5-f53f-43ca-a456-db32f7665119,Tôi thực sự thích chơi trò chơi này.,0.0,0.0,0.0,0.0,2.0,0.0,0.0,0.0,0.0,0.0
4977bc93-fcbb-45f8-a16b-a8f3aa316928,"Mỗi lần tôi cố gắng mở nó, ứng dụng lại bị sập nhưng vẫn có vẻ như đang chạy ở chế độ nền.",0.0,0.0,0.0,1.0,0.0,0.0,0.0,0.0,0.0,0.0
49beeb24-561a-4c8c-90c9-7cbfafd45a1d,"Sau đó, ứng dụng muốn tôi phải trả tiền một lần nữa để có thể sử dụng nó.",0.0,1.0,0.0,0.0,0.0,0.0,0.0,0.0,0.0,0.0
49febcbc-992c-4bb0-893c-2f682a534884,Chúa biết là anh đã kiếm đủ từ tôi rồi.,0.0,0.0,0.0,0.0,0.0,1.0,0.0,0.0,0.0,0.0
4a264264-2c2f-48ee-9f1c-53aa959274d2,Tôi đã thử xóa và tải lại ứng dụng suốt cả ngày nhưng vẫn nhận được cùng một thông báo.,0.0,0.0,0.0,0.0,0.0,0.0,0.0,1.0,0.0,0.0
4a5332f3-264e-40c1-b25e-85d8ed64c0f7,"Và việc đuổi người chơi ra khỏi trò chơi đặc biệt là khó, đặc biệt khi mọi người phải bỏ phiếu để họ rời đi.",0.0,0.0,0.0,0.0,0.0,1.0,0.0,0.0,0.0,0.0
4a6fe916-76ca-47df-a1fc-2c57b483f97a,Vậy các trò chơi đã được tải xuống trước đó đã biến mất.,0.0,0.0,0.0,0.0,0.0,0.0,0.0,1.0,0.0,0.0
4aa8bf70-1d8d-450a-828e-9096ff985403,Và tôi nghĩ bạn nên thêm rồng chỉ để vui thôi :).,0.0,0.0,0.0,0.0,2.0,0.0,0.0,0.0,0.0,0.0
4acda4ec-d2c0-48a5-b10e-fbdf33aca21a,Tôi không muốn bị hack.,0.0,0.0,0.0,0.0,0.0,0.0,0.0,0.0,0.0,1.0
4aeca1b3-5123-4990-b4a1-aa376e00b5f0,"Tôi đã từng chơi Among Us nhưng giờ đây không còn nữa và đây là lý do:
Được duy trì kém.",0.0,0.0,0.0,0.0,0.0,1.0,0.0,0.0,0.0,0.0
4b1237f5-3255-4655-9e54-fbf843b26101,"Không cần nhiều hình ảnh động, điều này có thể giúp giảm ngốn pin hoặc ít nhất là cung cấp tùy chọn để tắt một số tính năng đó.",0.0,0.0,0.0,2.0,0.0,0.0,0.0,0.0,0.0,0.0
4b2ae530-f9cc-411a-b1e7-0a4a028121f8,Tôi vẫn sẽ chơi trò chơi này vì tôi thực sự yêu thích ý tưởng của nó!!,0.0,0.0,0.0,0.0,2.0,0.0,0.0,0.0,0.0,0.0
4b415c36-9deb-4f88-9694-9b0d28af1184,"Trò chơi này, nhược điểm của những con xúc xắc luôn luôn chống lại bạn, đã làm cho trò chơi này CỰC KỲ KHÓ CHỊU KHI CHƠI!!",0.0,0.0,0.0,0.0,1.0,0.0,0.0,0.0,0.0,0.0
4b47f4f7-191b-48dd-b395-adec6b1d0877,Tôi không biết điều này có liên quan đến máy chủ hay không nhưng điều này đã xảy ra hầu hết thời gian.,0.0,0.0,0.0,0.0,0.0,1.0,0.0,0.0,0.0,0.0
